service_id,title,purpose_summary,category,org_name,org_type,org_code,applicant_type,support_type,support_desc,target_desc,apply_method,apply_period,apply_from,apply_to,phone,detail_url,created_at,updated_at,views,min_amount,max_amount,raw,cond_target,cond_selection,cond_age,cond_income,cond_residence,cond_eligibility
000000465790,유아학비 (누리과정) 지원,"유치원에 다니는 만 3~5세 아동에게 유아학비, 방과후과정비 등 지원",보육·교육,교육부,중앙행정기관,1342000,개인,현금(감면),"○ 3~5세에 대해 교육비를 지급합니다. - 국공립 100,000원, 사립 280,000원 ○ 3~5세에 대해 방과후과정비를 지급합니다. - 국공립 50,000원, 사립 70,000원 ○ 사립유치원을 다니는 법정저소득층 유아에게 저소득층 유아학비를 추가 지급합니다. - 사립 200,000원","○ 지원대상 : 국공립 및 사립유치원에 다니는 3~5세 유아 - '22년 1~2월생으로 유치원 입학을 희망하여 3세반에 취원한 유아도 지원 대상 - 취학대상 아동('18.1.1~12.31.출생)이 취학을 유예하는 경우, 유예한 1년에 한하여 5세 유아 무상교육비 지원(취학유예 통지서 제출) ※ 단, 지원기간은 3년을 초과할 수 없음. ○ 추가지원 : 저소득층 유아(유아학비 지원 대상 자격이 있고, 사립유치원에 다니는 법정저소득층(기초생활수급자, 차상위계층, 한부모 가정) 유아) ○ 아래의 경우 지원대상에서 제외 - 대한민국 국적을 가지지 않은 유아(난민 및 「재한외국인 처우 기본법」에 따라 법무부장관이 인정한 '특별기여자 등'은 예외적으로 인정) - 가정 양육수당 및 어린이집 보육료를 지원 받고 있는 유아 - 유치원 이용시간에 아이돌봄서비스 등과 중복지원 불가 - 해외 체류 기간이 31일째 되는 날 유아학비 지원자격 중지 ○ 자격 중지 후 유아학비를 다시 지원받기 위해서는 재신청 필요, 신청 누락으로 발생되는 지원금은 소급지원 되지 않음.",기타 온라인신청||방문신청,상시신청,,,교육부/02-6222-6060||0079에듀콜/1544-0079-5-1,https://www.gov.kr/portal/rcvfvrSvc/dtlEx/000000465790,20201217142613,20250805161216,224604,50000.0,280000.0,"{""list"": {""등록일시"": ""20201217142613"", ""부서명"": ""영유아재정과"", ""사용자구분"": ""개인"", ""상세조회URL"": ""https://www.gov.kr/portal/rcvfvrSvc/dtlEx/000000465790"", ""서비스ID"": ""000000465790"", ""서비스명"": ""유아학비 (누리과정) 지원"", ""서비스목적요약"": ""유치원에 다니는 만 3~5세 아동에게 유아학비, 방과후과정비 등 지원"", ""서비스분야"": ""보육·교육"", ""선정기준"": ""※ 2025. 3. 1~2026.2.28. 까지 적용\r\n\r\n○ 지원대상 : 국공립유치원 및 사립유치원에 다니는  만 3~5세 아동\r\n       5세  '19.1.1.~'19.12.31.\r\n       4세  '20.1.1.~'20.12.31.\r\n       3세  '21.1.1.~'22.2.28.\r\n\r\n\r\n○ 신청인 : 아동의 보호자\r\n\r\n○ 신청장소 : 온라인 신청 (복지로 복지사업서비스 (www.bokjiro.go.kr) ) 및 읍면동 주민센터(아동 주민등록 주소지)\r\n\r\n - 주의: 온라인 신청은 부모만 가능\r\n   ※ 부모 이외의 보호자인 경우(자녀의 친권자 또는  후견인 보호자, 조부모, 사회복지시설장 등) 등 담당공무원의 확인이 필요한 경우는 온라인으로 신청하실수 없으므로 불편하시더라도 읍면동 주민센터(주소지 시군구)에서 신청하시기 바랍니다."", ""소관기관명"": ""교육부"", ""소관기관유형"": ""중앙행정기관"", ""소관기관코드"": ""1342000"", ""수정일시"": ""20250805161216"", ""신청기한"": ""상시신청"", ""신청방법"": ""기타 온라인신청||방문신청"", ""전화문의"": ""교육부/02-6222-6060||0079에듀콜/1544-0079-5-1"", ""접수기관"": ""주민센터"", ""조회수"": 224604, ""지원내용"": ""○ 3~5세에 대해 교육비를 지급합니다.\r\n  - 국공립 100,000원, 사립 280,000원\r\n\r\n○ 3~5세에 대해 방과후과정비를 지급합니다.\r\n   - 국공립 50,000원, 사립 70,000원\r\n\r\n○ 사립유치원을 다니는 법정저소득층 유아에게 저소득층 유아학비를 추가 지급합니다.\r\n   - 사립 200,000원"", ""지원대상"": ""○ 지원대상 : 국공립 및 사립유치원에 다니는 3~5세 유아\r\n  \r\n   - '22년 1~2월생으로 유치원 입학을 희망하여 3세반에 취원한 유아도 지원 대상\r\n   -  취학대상 아동('18.1.1~12.31.출생)이 취학을 유예하는 경우, 유예한 1년에 한하여 5세 유아 무상교육비 지원(취학유예 통지서 제출)\r\n   ※ 단, 지원기간은 3년을 초과할 수 없음.\r\n\r\n\r\n\r\n○ 추가지원 : 저소득층 유아(유아학비 지원 대상 자격이 있고, 사립유치원에 다니는 법정저소득층(기초생활수급자, 차상위계층, 한부모 가정) 유아)\r\n\r\n○  아래의 경우 지원대상에서 제외\r\n   -  대한민국 국적을 가지지 않은 유아(난민 및 「재한외국인 처우 기본법」에 따라 법무부장관이 인정한 '특별기여자 등'은 예외적으로 인정)\r\n   - 가정 양육수당 및 어린이집 보육료를 지원 받고 있는 유아\r\n   -  유치원 이용시간에 아이돌봄서비스 등과 중복지원 불가\r\n   - 해외 체류 기간이 31일째 되는 날 유아학비 지원자격 중지\r\n\r\n○  자격 중지 후 유아학비를 다시 지원받기 위해서는 재신청 필요, 신청 누락으로 발생되는 지원금은 소급지원 되지 않음."", ""지원유형"": ""현금(감면)""}, ""detail"": null, ""cond"": null}","○ 지원대상 : 국공립 및 사립유치원에 다니는 3~5세 유아 - '22년 1~2월생으로 유치원 입학을 희망하여 3세반에 취원한 유아도 지원 대상 - 취학대상 아동('18.1.1~12.31.출생)이 취학을 유예하는 경우, 유예한 1년에 한하여 5세 유아 무상교육비 지원(취학유예 통지서 제출) ※ 단, 지원기간은 3년을 초과할 수 없음. ○ 추가지원 : 저소득층 유아(유아학비 지원 대상 자격이 있고, 사립유치원에 다니는 법정저소득층(기초생활수급자, 차상위계층, 한부모 가정) 유아) ○ 아래의 경우 지원대상에서 제외 - 대한민국 국적을 가지지 않은 유아(난민 및 「재한외국인 처우 기본법」에 따라 법무부장관이 인정한 '특별기여자 등'은 예외적으로 인정) - 가정 양육수당 및 어린이집 보육료를 지원 받고 있는 유아 - 유치원 이용시간에 아이돌봄서비스 등과 중복지원 불가 - 해외 체류 기간이 31일째 되는 날 유아학비 지원자격 중지 ○ 자격 중지 후 유아학비를 다시 지원받기 위해서는 재신청 필요, 신청 누락으로 발생되는 지원금은 소급지원 되지 않음.","※ 2025. 3. 1~2026.2.28. 까지 적용 ○ 지원대상 : 국공립유치원 및 사립유치원에 다니는 만 3~5세 아동 5세 '19.1.1.~'19.12.31. 4세 '20.1.1.~'20.12.31. 3세 '21.1.1.~'22.2.28. ○ 신청인 : 아동의 보호자 ○ 신청장소 : 온라인 신청 (복지로 복지사업서비스 (www.bokjiro.go.kr) ) 및 읍면동 주민센터(아동 주민등록 주소지) - 주의: 온라인 신청은 부모만 가능 ※ 부모 이외의 보호자인 경우(자녀의 친권자 또는 후견인 보호자, 조부모, 사회복지시설장 등) 등 담당공무원의 확인이 필요한 경우는 온라인으로 신청하실수 없으므로 불편하시더라도 읍면동 주민센터(주소지 시군구)에서 신청하시기 바랍니다.","3세
4세
5세",,,
105100000001,근로·자녀장려금,"소득과 재산이 적은 근로소득자에게 근로장려금을, 자녀가 있을 경우 자녀장려금 지급",주거·자립,국세청,중앙행정기관,1210000,가구,현금,"○ 전년도 연간 부부합산 총 급여액 등(근로소득, 사업소득 또는 종교인소득의 합계)에 따라 - 근로장려금은 ㆍ 단독가구 최대 165만 원 ㆍ 홑벌이 가구 최대 285만 원 ㆍ 맞벌이 가구 최대 330만 원 지급 - 자녀 장려금은 ㆍ 단독가구 해당 없음 ㆍ 홑벌이 가구 부양자녀 1명 당 최대 100만 원 ㆍ 맞벌이 가구 부양자녀 1명 당 최대 100만 원 지급 * 자세한 산정식은 홈택스(www.hometax.go.kr)에서 확인 바랍니다","○ 신청요건을 모두 충족하는 근로소득, 사업소득 또는 종교인소득이 있는 가구로써 신청기간 내 신청하는 경우 근로소득, 사업소득 또는 종교인소득에 따라 산정한 근로장려금과 부양자녀수에 따라 산정한 자녀장려금을 지급",기타 온라인신청,○ 정기신청 : 5.1.~5.31.○ 반기신청 - 상반기분 신청 : 9.1.~9.15. - 하반기분 신청 : 3.1.~3.15.,,,해당지역 지자체(세무서)/관할 세무서,https://www.gov.kr/portal/rcvfvrSvc/dtlEx/105100000001,20201217142613,20250717101438,1691373,1000000.0,3300000.0,"{""list"": {""등록일시"": ""20201217142613"", ""부서명"": ""장려세제과"", ""사용자구분"": ""가구"", ""상세조회URL"": ""https://www.gov.kr/portal/rcvfvrSvc/dtlEx/105100000001"", ""서비스ID"": ""105100000001"", ""서비스명"": ""근로·자녀장려금"", ""서비스목적요약"": ""소득과 재산이 적은 근로소득자에게 근로장려금을, 자녀가 있을 경우 자녀장려금 지급"", ""서비스분야"": ""주거·자립"", ""선정기준"": ""○ 아래 요건을 모두 충족하는 근로소득, 사업소득 또는 종교인소득이 있는 가구\r\n\r\n- 소득요건 : 전년도 부부합산 연간 총소득이 가구 유형에 따라 정한 총 소득기준금액 미만일 것\r\n  (근로장려금)\r\n  ㆍ 단독가구 : 2,200만 원 미만\r\n  ㆍ 홑벌이 가구 : 3,200만 원 미만\r\n  ㆍ 맞벌이 가구 : 4,400만 원 미만\r\n  (자녀장려금)\r\n  ㆍ 7,000만 원 미만\r\n - 재산요건\r\n  ㆍ 전년도 6월 1일 현재, 가구원 전체의 재산 합계액이 2억4천만 원 미만일 것\r\n- 가구요건\r\n  ㆍ 단독가구 : 배우자1), 부양자녀2), 70세 이상 직계존속3)이 모두 없는 가구\r\n  ㆍ 홑벌이가구 : 배우자 또는 부양자녀 또는 70세 이상 직계존속이 있는 가구(배우자가 있는 경우에는 신청인 또는 배우자의 총급여액 등이 3백만원 미만이어야 함)\r\n  ㆍ 맞벌이가구 : 신청인과 배우자 각각의 총급여액 등이 3백만원 이상인 가구\r\n     1) 배우자 : 법률상 배우자(사실혼 제외)\r\n     2) 부양자녀 : (18세 미만) and (연간소득금액 100만원 이하)\r\n     3) 직계존속 : (70세 이상) and (연간소득금액 100만원 이하) and (주민등록 동거 및 부양)\r\n     *부양자녀 및 직계존속 중 동일주소 거주하거나, 질병 등으로 일시퇴거한 중증장애인은 연령 제한 없음\r\n\r\n<신청 제외> 위 요건을 모두 충족하는 경우에도 아래 유형에 해당하는 경우 신청할 수 없음\r\n -전년도 12.31.현재 대한민국 국적을 보유하지 아니한 자\r\n  (대한민국 국적을 보유한 자와 혼인한 자, 대한민국 국적의 부양자녀가 있는 자는 신청할 수 있음)\r\n -전년도 중 다른 거주자의 부양자녀인 자\r\n -전문직 사업을 영위하는 자(그 배우자 포함)\r\n\r\n※ 총소득과 총급여액 등 비교\r\n - 총소득 \r\n  ㆍ 근로, 사업, 종교인, 기타, 이자, 배당, 연금소득의 합계금액(부부합산)\r\n  ㆍ 신청자격 중 소득요건(가구 유형별 기준금액) 판정기준\r\n - 총급여액 등\r\n  ㆍ 근로, 사업, 종교인 소득의 합계금액(부부합산)\r\n  ㆍ 장려금 지급액을 산정·결정하는 기준\r\n  ㆍ 총급여액 등에서 제외되는 소득 : 비과세 소득, 본인 및 배우자의 직계존비속에게 받은 근로소득 및 사업소득, 사업자등록 없는 자의 사업소득, 사업자등록 없는 자에게 받은 근로소득, 인정상여 근로소득(법인세법 제67조에 의한 소득처분)\r\n\r\n* 자세한 신청요건은 국세청 홈택스(www.hometax.go.kr)에서 확인 바랍니다"", ""소관기관명"": ""국세청"", ""소관기관유형"": ""중앙행정기관"", ""소관기관코드"": ""1210000"", ""수정일시"": ""20250717101438"", ""신청기한"": ""○ 정기신청 : 5.1.~5.31.○ 반기신청 - 상반기분 신청 : 9.1.~9.15. - 하반기분 신청 : 3.1.~3.15."", ""신청방법"": ""기타 온라인신청"", ""전화문의"": ""해당지역 지자체(세무서)/관할 세무서"", ""접수기관"": ""관할 세무서"", ""조회수"": 1691373, ""지원내용"": ""○ 전년도 연간 부부합산 총 급여액 등(근로소득, 사업소득 또는 종교인소득의 합계)에 따라\r\n - 근로장려금은\r\n  ㆍ 단독가구 최대 165만 원\r\n  ㆍ 홑벌이 가구 최대 285만 원\r\n  ㆍ 맞벌이 가구 최대 330만 원 지급\r\n - 자녀 장려금은\r\n  ㆍ 단독가구 해당 없음\r\n  ㆍ 홑벌이 가구 부양자녀 1명 당 최대 100만 원\r\n  ㆍ 맞벌이 가구 부양자녀 1명 당 최대 100만 원 지급\r\n\r\n* 자세한 산정식은 홈택스(www.hometax.go.kr)에서 확인 바랍니다"", ""지원대상"": ""○ 신청요건을 모두 충족하는 근로소득, 사업소득 또는 종교인소득이 있는 가구로써 신청기간 내 신청하는 경우 근로소득, 사업소득 또는 종교인소득에 따라 산정한 근로장려금과 부양자녀수에 따라 산정한 자녀장려금을 지급"", ""지원유형"": ""현금""}, ""detail"": null, ""cond"": null}","○ 신청요건을 모두 충족하는 근로소득, 사업소득 또는 종교인소득이 있는 가구로써 신청기간 내 신청하는 경우 근로소득, 사업소득 또는 종교인소득에 따라 산정한 근로장려금과 부양자녀수에 따라 산정한 자녀장려금을 지급","○ 아래 요건을 모두 충족하는 근로소득, 사업소득 또는 종교인소득이 있는 가구 - 소득요건 : 전년도 부부합산 연간 총소득이 가구 유형에 따라 정한 총 소득기준금액 미만일 것 (근로장려금) ㆍ 단독가구 : 2,200만 원 미만 ㆍ 홑벌이 가구 : 3,200만 원 미만 ㆍ 맞벌이 가구 : 4,400만 원 미만 (자녀장려금) ㆍ 7,000만 원 미만 - 재산요건 ㆍ 전년도 6월 1일 현재, 가구원 전체의 재산 합계액이 2억4천만 원 미만일 것 - 가구요건 ㆍ 단독가구 : 배우자1), 부양자녀2), 70세 이상 직계존속3)이 모두 없는 가구 ㆍ 홑벌이가구 : 배우자 또는 부양자녀 또는 70세 이상 직계존속이 있는 가구(배우자가 있는 경우에는 신청인 또는 배우자의 총급여액 등이 3백만원 미만이어야 함) ㆍ 맞벌이가구 : 신청인과 배우자 각각의 총급여액 등이 3백만원 이상인 가구 1) 배우자 : 법률상 배우자(사실혼 제외) 2) 부양자녀 : (18세 미만) and (연간소득금액 100만원 이하) 3) 직계존속 : (70세 이상) and (연간소득금액 100만원 이하) and (주민등록 동거 및 부양) *부양자녀 및 직계존속 중 동일주소 거주하거나, 질병 등으로 일시퇴거한 중증장애인은 연령 제한 없음 <신청 제외> 위 요건을 모두 충족하는 경우에도 아래 유형에 해당하는 경우 신청할 수 없음 -전년도 12.31.현재 대한민국 국적을 보유하지 아니한 자 (대한민국 국적을 보유한 자와 혼인한 자, 대한민국 국적의 부양자녀가 있는 자는 신청할 수 있음) -전년도 중 다른 거주자의 부양자녀인 자 -전문직 사업을 영위하는 자(그 배우자 포함) ※ 총소득과 총급여액 등 비교 - 총소득 ㆍ 근로, 사업, 종교인, 기타, 이자, 배당, 연금소득의 합계금액(부부합산) ㆍ 신청자격 중 소득요건(가구 유형별 기준금액) 판정기준 - 총급여액 등 ㆍ 근로, 사업, 종교인 소득의 합계금액(부부합산) ㆍ 장려금 지급액을 산정·결정하는 기준 ㆍ 총급여액 등에서 제외되는 소득 : 비과세 소득, 본인 및 배우자의 직계존비속에게 받은 근로소득 및 사업소득, 사업자등록 없는 자의 사업소득, 사업자등록 없는 자에게 받은 근로소득, 인정상여 근로소득(법인세법 제67조에 의한 소득처분) * 자세한 신청요건은 국세청 홈택스(www.hometax.go.kr)에서 확인 바랍니다","18세
70세 이상","급여액 등(근로소득, 사업소득 또는 종교인소득의 합계)에 따라 - 근로장려금은 ㆍ 단독가구 최대 165만 원 
소득, 사업소득 또는 종교인소득이 있는 가구 - 소득요건 : 전년도 부부합산 연간 총소득이 가구 유형에 따라 정한 총 소득기준금액 미만일 것 (근로장려금) ㆍ 단독가구 : 2,200만 원 미만
소득금액 100만원 이하
재산요건 ㆍ 전년도 6월 1일 현재, 가구원 전체의 재산 합계액이 2억4천만 원 미만일 것 - 가구요건 ㆍ 단독가구 : 배우자1), 부양자녀2), 70세 이상 직계존속3)이 모두 없는 가구 ㆍ 홑벌이가구 : 배우자 또는 부양자녀 또는 70세 이상 직계존속이 있는 가구(배우자가 있는 경우에는 신청인 또는 배우자의 총급여액 등이 3백만원 미만이어야 함) ㆍ 맞벌이가구 : 신청인과 배우자 각각의 총급여액 등이 3백만원 이상인 가구 1) 배우자 : 법률상 배우자(사실혼 제외) 2) 부양자녀 : (18세 미만) and (연간소득금액 100만원 이하",해당지역 지자체(세무서)/관할 세무서,
116010000001,주택금융공사 월세 자금보증,일정요건의 월세대출 대상자에게 월세자금보증을 지원,주거·자립,한국주택금융공사,공공기관,B551408,개인,상담/법률지원||현금(융자),○ 주택도시기금 주거안정 월세대출 요건을 충족하는 대상자에 대해 월세자금보증 지원 - 월세금을 2년간 환산한 금액의 90%를 지원,○ 보증금 1억 원 이하 및 월세금 60만 원 이하인 월세 계약을 체결한 주택도시 기금 주거안정 월세대출 대상자,방문신청,주택도시기금 주거안정 월세대출 규정에 따름,,,주택금융공사/1688-8114,https://www.gov.kr/portal/rcvfvrSvc/dtlEx/116010000001,20201217142613,20241018141915,31236,,,"{""list"": {""등록일시"": ""20201217142613"", ""부서명"": ""주택보증부"", ""사용자구분"": ""개인"", ""상세조회URL"": ""https://www.gov.kr/portal/rcvfvrSvc/dtlEx/116010000001"", ""서비스ID"": ""116010000001"", ""서비스명"": ""주택금융공사 월세 자금보증"", ""서비스목적요약"": ""일정요건의 월세대출 대상자에게 월세자금보증을 지원"", ""서비스분야"": ""주거·자립"", ""선정기준"": ""○ (주택도시기금 주거안정 월세대출 대상자 요건) 무주택 세대주(세대원 전원 포함)로서 다음 중 하나에 해당하는 경우 지원\r\n- 취업준비생(신청일 현재 만 35세 이하의 무소득자이며 부모 소득이 6천만원 이하인 자)\r\n- 희망키움통장 가입자\r\n- 최근 1년 이내 수급사실이 인정되는 근로장려금 수급자\r\n- 취업 후 5년 이내인 사회초년생으로 신청일 현재 만 35세 이하이며 부부합산 연소득 4천만원 이하인 자\r\n- 최근 1년 이내 수급사실이 인정되는 자녀장려금 수급자\r\n- 주거급여 수급자\r\n- 부부합산 연소득 5천만원 이하인 자로 위 5개 대상자에 해당되지 않는 자"", ""소관기관명"": ""한국주택금융공사"", ""소관기관유형"": ""공공기관"", ""소관기관코드"": ""B551408"", ""수정일시"": ""20241018141915"", ""신청기한"": ""주택도시기금 주거안정 월세대출 규정에 따름"", ""신청방법"": ""방문신청"", ""전화문의"": ""주택금융공사/1688-8114"", ""접수기관"": ""한국주택금융공사"", ""조회수"": 31236, ""지원내용"": ""○ 주택도시기금 주거안정 월세대출 요건을 충족하는 대상자에 대해 월세자금보증 지원\r\n - 월세금을 2년간 환산한 금액의 90%를 지원"", ""지원대상"": ""○ 보증금 1억 원 이하 및 월세금 60만 원 이하인 월세 계약을 체결한 주택도시 기금 주거안정 월세대출 대상자"", ""지원유형"": ""상담/법률지원||현금(융자)""}, ""detail"": null, ""cond"": null}",○ 보증금 1억 원 이하 및 월세금 60만 원 이하인 월세 계약을 체결한 주택도시 기금 주거안정 월세대출 대상자,○ (주택도시기금 주거안정 월세대출 대상자 요건) 무주택 세대주(세대원 전원 포함)로서 다음 중 하나에 해당하는 경우 지원 - 취업준비생(신청일 현재 만 35세 이하의 무소득자이며 부모 소득이 6천만원 이하인 자) - 희망키움통장 가입자 - 최근 1년 이내 수급사실이 인정되는 근로장려금 수급자 - 취업 후 5년 이내인 사회초년생으로 신청일 현재 만 35세 이하이며 부부합산 연소득 4천만원 이하인 자 - 최근 1년 이내 수급사실이 인정되는 자녀장려금 수급자 - 주거급여 수급자 - 부부합산 연소득 5천만원 이하인 자로 위 5개 대상자에 해당되지 않는 자,만 35세,,,
