service_id,title,purpose_summary,category,org_name,org_type,applicant_type,support_type,support_desc,apply_method,apply_period,min_amount,max_amount,phone,detail_url,age_min,age_max,age_unit,age_note,age_restriction,income_type,income_percentage,income_amount,income_unit,income_note,income_restriction,target_age_group,target_employment,target_education,target_household,target_special,target_occupation,target_specific_conditions,target_note,selection_method,required_documents,evaluation_criteria,selection_specific_conditions,selection_note,residence_type,specific_regions,residence_duration,residence_duration_unit,residence_specific_conditions,residence_note
135200005011,입양축하금,1회에 한하여 200만원 입양축하금 지급,임신·출산,보건복지부,중앙행정기관,개인,현금,1회에 한하여 200만원 입양축하금 지급,방문신청,지급신청분에 대해 매월 20일에 1회 지급,2000000.0,2000000.0,보건복지상담센터/129,https://www.gov.kr/portal/rcvfvrSvc/dtlEx/135200005011,,,,,제한없음,,,,,,제한없음,,,,,[],[],입양특례법상 허가를 받은 입양기관에 의해 아동을 국내입양한 가정 중에서 가정법원 입양 확정일이 2022년 1월 1일 이후인 가정으로 지원 대상 제한,"2022년 사업 신설로 인해, 입양 확정일이 2022년 1월 1일 이후인 가정으로 지원 대상 제한",서류심사,"['입양 허가증', '가정 입양 확정서']",['가정법원 입양 확정일이 2022년 1월 1일 이후인 경우'],"2022년 사업 신설로 인해, 입양 확정일이 2022년 1월 1일 이후인 가정으로 지원 대상 제한",,전국,[],,,,
135200005012,자산형성지원사업(희망저축Ⅱ),일하는 주거‧교육급여 수급자와 차상위자를 대상으로 본인적립금(10만 원)에 정부지원금(10,주거·자립,보건복지부,중앙행정기관,가구,현금,"일하는 주거‧교육급여 수급자와 차상위자를 대상으로 본인적립금(10만 원)에 정부지원금(10만 원)을 매칭하여 지급 -(지원대상) 소득인정액이 기준 중위소득 50% 이하인 주거.교육급여 수급 가구 및 기타 차상위 계층, 현재 근로활동 중이며 근로.사업소득이 있는 가구",방문신청,"24년 2월, 5월, 8월 모집예정 , 세부 모집일정은 주민센터 통해 문의",100000.0,100000.0,보건복지상담센터/129||자산형성지원콜센터/1522-3690,https://www.gov.kr/portal/rcvfvrSvc/dtlEx/135200005012,,,,,제한없음,중위소득,50.0,10.0,만원,,있음,,취업자,,,['차상위계층'],"['농업인', '어업인', '자영업자', '프리랜서', '기타']","소득인정액이 기준 중위소득 50% 이하인 주거.교육급여 수급 가구 및 기타 차상위 계층, 현재 근로활동 중이며 근로.사업소득이 있는 가구",,서류심사,"['소득증명서', '가구원 명의자 증명서']","['소득인정액 기준 중위소득 50% 이하', '근로.사업소득 확인']",주거.교육급여 수급 가구 또는 차상위 계층으로 인정되는 자,,전국,[],,,,
135200005013,자산형성지원사업(청년내일저축계좌),상동,주거·자립,보건복지부,중앙행정기관,개인,현금,"기존 차상위 이하 청년에서 기준 중위 100% 이하 가구의 저소득 근로청년까지 지원대상을 대폭 확대하여 본인적립금(10만 원)에 정부지원금(10~30만 원)을 매칭하여 지급 - 지원내용 : 본인 저축액(월 10만 원) 대비 1:1 정부매칭 지원 (단, 수급자·차상위 청년은 1:3 정부매칭 지원)",기타 온라인신청||방문신청,"24년 5월 모집 예정 , 세부 모집일정은 주민센터 문의",100000.0,300000.0,보건복지상담센터/129||자산형성지원콜센터/1522-3690,https://www.gov.kr/portal/rcvfvrSvc/dtlEx/135200005013,34.0,39.0,세,,있음,중위소득,100.0,10.0,만원,,있음,청년,취업자,,,"['수급자', '차상위계층']",,"본인적립금(10만 원)에 정부지원금(10~30만 원)을 매칭하여 지급, 본인 저축액(월 10만 원) 대비 1:1 정부매칭 지원 (단, 수급자·차상위 청년은 1:3 정부매칭 지원)","가입연령 19∼34세 이하 (수급자·차상위자는 만15∼39세 이하), 현재 근로활동 중이며, 근로‧사업소득이 50만원 이상~상한액(모집시 별도 공지) 이하 (수급자‧차상위자는 현재 근로활동 중이며, 근로‧사업소득이 월 10만원 이상), 기준 중위소득 100% 이하",서류심사,"['신분증 사본', '소득증빙서류']","['가입연령 19∼34세', '근로‧사업소득 50만원 이상~상한액 이하', '가구소득 중위소득 100% 이하']","수급자 및 차상위자는 가입연령 15∼39세, 근로‧사업소득 월 10만원 이상",,전국,[],,,,
135200005015,첫만남이용권 지원,200만원 이상의 첫만남이용권 지급,임신·출산,보건복지부,중앙행정기관,개인,이용권||현금,"출생아로서 출생신고되어 정상적으로 주민등록번호를 부여받은 아동에게 200만원 이상의 첫만남이용권 지급 '24년 1월 1일 이후 출생아는 첫째아 200만원, 둘째아 이상 300만원 지급",기타 온라인신청||방문신청,상시신청,2000000.0,3000000.0,출산정책과/044-202-3398||출산정책과/044-202-3397,https://www.gov.kr/portal/rcvfvrSvc/dtlEx/135200005015,,,,,제한없음,,,,,,제한없음,전연령,무관,무관,무관,[],[],출생아로서 출생신고되어 정상적으로 주민등록번호를 부여받은 아동(주민등록상 생년월일로부터 1년이 초과되지 않는 출생아) * 2024년 1월 1일 이후 출생아는 주민등록상 생년월일로부터 2년내에 신청하여 사용 가능,,서류심사,"['출생신고증명서', '주민등록등본']","['출생아 여부 확인', '주민등록번호 발급일 기준']",출생아로서 정상적으로 주민등록번호를 부여받은 아동에 한함,2024년 1월 1일 이후 출생아는 주민등록상 생년월일로부터 2년내에 신청하여 사용 가능,전국,[],,,,
135200005016,전문아동보호비 지원,위탁가정에 대하여 월 100만원 지급,보호·돌봄,보건복지부,중앙행정기관,개인,현금,"○ 위기아동 가정보호사업 - (지원대상) 즉각분리 또는 응급조치에 따라 원가정에서 분리된 학대피해아동, 2세 이하 아동, 장애아동 경계선지능아동 등을 일시보호중인 보호가정 - (지원기간) 일시보호 종료 시까지(가정복귀 또는 중장기 보호조치 시까지, 최대 6개월이내) ○ 전문가정위탁 - (지원대상) 전문위탁아동(학대피해아동, 2세 이하 영아, 장애아동, 경계선지능 아동 등)을 보호 중인 전문위탁가정 - (지원기간) 전문가정위탁보호 목적 달성 시까지",방문신청,상시신청,,,가정위탁지원센터/1577-1406,https://www.gov.kr/portal/rcvfvrSvc/dtlEx/135200005016,2.0,2.0,세,,없음,,,,,,제한없음,,,,,"['장애아동', '경계선지능아동', '학대피해아동', '2세 이하 아동', '전문위탁아동']",,위기아동 가정보호사업 및 전문가정위탁 지원대상,일시보호 및 전문가정위탁 보호 기간 및 대상에 대한 설명 포함,서류심사,"['가정위탁보호자 경력증명서', '전문가 자격증 사본']","['일반가정위탁 기준 충족', '전문가 자격 기준 충족']",가정위탁보호자 중 1인 이상이 전문가정위탁 부모교육 이수,,전국,[],,,,
135200005017,한국형 상병수당 시범사업,업무 외 질병·부상으로 경제활동이 어려운 경우 치료에 집중할 수 있도록 상병수당 지원,생활안정,보건복지부,중앙행정기관,개인,현금,"【1단계】~24. 12. 31.부 종료 ○ 모형1 (경기 부천시, 경북 포항시) - 질병·부상으로 일을 하지 못하는 기간(대기기간 7일 제외) 동안 일 47,560원 지급 - 1년 동안 최대 120일까지 지원 가능 ○ 모형2 (서울 종로구, 충남 천안시) - 질병·부상으로 일을 하지 못하는 기간(대기기간 14일 제외) 동안 일 47,560원 지급 - 1년 동안 최대 150일까지 지원 가능 ○ 모형3 (전남 순천시, 경남 창원시) - 질병·부상의 치료를 위한 입원 및 외래 진료일수(대기기간 3일 제외)에 대해 일 47,560원 지급 - 1년 동안 최대 120일까지 지원 가능 【2단계】 ○ 모형4(경기 안양시, 대구 달서구) - 질병·부상으로 일을 하지 못하는 기간(대기기간 7일 제외) 동안 일 47,560원 지급 - 1년 동안 최대 150일까지 지원 가능 ○ 모형5(경기 용인시, 전북 익산시) - 질병·부상의 치료를 위한 입원 및 외래 진료일수(대기기간 3일 제외)에 대해 일47,560원 지급 - 1년 동안 최대 150일까지 지원 【3단계】 ○ 모형4(충북 충주시, 충남 홍성군, 전북 전주시, 강원 원주시) - 질병·부상으로 일을 하지 못하는 기간(대기기간 7일 제외) 동안 일 47,560원 지급 - 1년 동안 최대 150일까지 지원 가능",기타 온라인신청||방문신청,상시신청,47560.0,47560.0,국민건강보험공단 고객센터/1577-1000,https://www.gov.kr/portal/rcvfvrSvc/dtlEx/135200005017,15.0,65.0,세,,있음,중위소득,120.0,,%,,있음,청년,취업자,,,"['장애인', '한부모', '다문화', '북한이탈주민', '기초생활수급자', '차상위계층', '기타']",['자영업자'],"시범사업 대상지역 거주 취업자 또는 시범사업 지역 소재 사업장 근로자, 만 15세 이상 ~ 만 65세 미만 대한민국 국적자",시범사업 대상지역 및 자격 요건에 따라 지원 대상자 선정,서류심사,"['자격증', '의료인증서']",[],국민건강보험공단에서 자격 및 의료인증 심사를 통해 급여 지급 결정,,전국,[],,,,
135200005024,금연캠프사업,스스로 금연이 어려운 중증․고도흡연자의 금연치료를 위한 전문적인 금연 프로그램 제공,보건·의료,보건복지부,중앙행정기관,개인,기타||기타(상담),"- (전문치료형) 중증고도흡연자* 대상, 최소 5일 이상 지역금연지원센터에 입원하여 전문적 치료․상담, 니코틴보조제, 금연치료제 제공 등 프로그램 제공하고 6개월간 9회 이상 대면상담, 전화상담 제공 * 흡연관련 질병력(악성종양, 만성 폐질환, 심뇌혈관질환 등)이 있는 흡연자 또는 20년 이상 담배를 피우고, 2회 이상 금연실패 경험이 있는 흡연자 - (입원환자지원서비스) 병원입원환자를 대상으로 금연상태 측정, 금연상담 및 교육서비스, 금연치료제를 제공하고 퇴원 후 금연결심일로부터 6개월간 병원 외래 또는 지역금연지원센터 방문 예약을 통해 금연치료 및 상담을 제공",기타 온라인신청||방문신청||직접입력,상시신청,,,한국건강증진개발원 국가금연지원센터 금연사업팀/02-3781-2221,https://www.gov.kr/portal/rcvfvrSvc/dtlEx/135200005024,,,,,제한없음,,,,,,제한없음,,,,,[],[],"중증고도흡연자, 시급하게 금연이 필요한 급만성질환을 가진 흡연자",,서류심사,[],[],"중증 고도 흡연자, 시급하게 금연이 필요한 급만성질환을 가진 흡연자",,지역금연지원센터,[],5.0,일,"전문치료형 중증고도흡연자 대상, 흡연관련 질병력이 있는 흡연자 또는 20년 이상 담배를 피우고, 2회 이상 금연실패 경험이 있는 흡연자","최소 5일 이상 입원하여 전문적 치료․상담, 니코틴보조제, 금연치료제 제공 및 6개월간 9회 이상 대면상담, 전화상담 제공"
135200005026,긴급돌봄 지원,일시적 위기상황에 대응하기 위한 한시적 재가 방문형 돌봄·가사 및 이동지원 서비스 제공,생활안정,보건복지부,중앙행정기관,개인,서비스(돌봄),"○ 일시적 위기상황에 대응하기 위한 한시적 재가 방문형 돌봄·가사 및 이동지원 및 방문목욕 서비스 제공 * 방문목욕은 일부 시·도에서 제공 중이며, 현장방문 결과와 상관없이 본인이 희망하는 경우 서비스를 제공받을 수 있음 (서비스 제공기간 내 최대 4회) - (내용) 일정 자격을 갖춘 서비스 제공인력이 대상자의 가정을 방문해 기본돌봄 서비스(재가 돌봄, 가사·이동 지원) 및 방문목욕 서비스를 제공 - (시간) 최대 72시간의 범위 내에서 지원하며, 가급적 30일 이내에 사용을 권고 * 자세한 사항은 지자체(읍·면·동, 시·군·구)에 문의",기타 온라인신청||방문신청,지자체별 상이,,,긴급돌봄 대표번호/1522-0365,https://www.gov.kr/portal/rcvfvrSvc/dtlEx/135200005026,19.0,,세,,있음,,,,,,제한없음,,,,,[],[],"주 돌봄자 부재, 질병, 부상 등으로 긴급하고 일시적 돌봄 지원이 필요하나 기존 서비스로 돌봄을 받기 어려운 국민",,서류심사,[],"['긴급성', '돌봄 필요성', '보충성']","'가, 나, 다, 라'의 요건을 모두 충족해야 함","대상자는 19세 이상의 대한민국 국적자로서, 다른 공적 돌봄 서비스를 받고 있지 않아야 하며, 돌봄이 필요한데 돌볼 수 있는 가구원이 없는 경우에 해당함",전국,[],,,,
135200005027,일상돌봄 서비스,"필요에 맞게 기본서비스(재가돌봄, 가사)와 특화서비스(식사영양 등)를 선택적 조합하여 이용",생활안정,보건복지부,중앙행정기관,개인||가구,이용권,"대상자로 선정되면 필요에 맞게 서비스를 선택해 지자체에서 이용권(바우처)을 발급받은 후, 제공기관에서 서비스 이용 ○ 기본서비스(24·36·72시간) 및 특화서비스(최대 2개)를 조합하여 이용 가능 - 기본서비스는 재가 돌봄(세면 등 신체청결, 옷 갈아입히기 등 몸단장 지원, 식사도움, 체위변경, 안전관리 등 신체 수발지원 및 건강지원 등), 가사 지원(청소, 세탁, 식사 준비 등 가정 내 일상생활을 위한 가정환경 마련) 제공 ○ 특화서비스는 식사영양관리 서비스 등 11종을 제공 - 식사관리 서비스 : 질환 등으로 스스로 식사준비가 어려운 대상에게 맞춤형 식사 지원 - 영양관리 서비스 : 질환 등으로 스스로 식사준비가 어려운 대상에게 맞춤형 식사 지원 및 영양관리 - 병원 동행 서비스 : 거동이 불편한 이용자의 병원 이동 보조, 병원 접수·수납 등 지원 - 심리 지원 서비스 : 전문가에 의한 맞춤형 심리지원 실시 - 휴식 지원 서비스 : 단기 시설보호 지원 - 소셜 다이닝 서비스 : 생활에 필요한 요리를 배우고 함께 식사하는 기회를 통해 교류 및 사회참여 증진 - 교류증진 지원 서비스 : 지역주민과의 일상적 소통 및 교류 증진 프로그램 제공 - 건강생활 지원 서비스 : 중장년의 일상생활 건강 상담 및 생활운동 프로그램 지원 - 신체건강 증진 서비스 : 청년의 근력향상, 체력증진 등 개인 맞춤형 운동 지원 - 간병 교육 서비스 : 간병·돌봄 방법 등에 대한 교육 제공 - 독립생활 지원 서비스 : 청년 자립기반 조성을 위한 교육 프로그램 제공 * 지역별로 제공하는 특화서비스는 다름",기타 온라인신청||방문신청,접수기관 별 상이,,,보건복지부 보건복지상담센터/129,https://www.gov.kr/portal/rcvfvrSvc/dtlEx/135200005027,39.0,64.0,세,,있음,,,,,,제한없음,중장년,무관,무관,1인가구 또는 2인가구,[],[],"일상생활에 돌봄이 필요한 청·중장년(19~64세)이며, 질병, 부상 등으로 어려움이 있는 자이고, 돌봄을 수행할 가족 등이 없는 경우",돌봄 필요 중장년 대상자,서류심사,"['진단서', '소견서', '장기요양인정서', '근로능력판정결과서', '추천서', '주민등록증']","['일상생활 돌봄 필요', '질병, 부상으로 어려움', '돌봄을 수행할 가족 없음', '가족 돌보는 청년', '가족의 질병, 부상으로 돌봄 필요', '경제활동 또는 돌봄 수행']","①일상생활에 돌봄이 필요한 청·중장년(19~64세) ②질병, 부상 등으로 일상 생활에 어려움이 있는 자 ③돌봄을 수행할 가족 등이 없는 자 ④가족을 돌보는 청년(9~39세) ⑤동거하는 가족의 질병, 부상 등으로 돌봄 필요성이 있는 자 ⑥동거 가족을 직접 돌보거나 가족 부양을 위해 경제활동을 하는 자",,전국,[],,,"대상자로 선정되어 이용권을 발급받은 후, 제공기관에서 기본서비스와 특화서비스를 조합하여 이용 가능","기본서비스에는 재가 돌봄 및 가사 지원이 포함되어 있으며, 특화서비스로는 식사영양관리 서비스 등 11종이 제공됩니다."
135200005030,기초연금 수급자 확인서,기초연금 수급자 확인서 발급,행정·안전,보건복지부,중앙행정기관,개인,현금,기초연금 수급자 확인서 발급,기타 온라인신청||방문신청,상시신청,,,보건복지상담센터/129||국민연금공단 콜센터/1355,https://www.gov.kr/portal/rcvfvrSvc/dtlEx/135200005030,65.0,,세,,있음,기타,,,,,있음,노인,,,,[],[],만 65세 이상 노인으로 소득 인정액이 선정기준액(보건복지부 장관이 매년 결정·고시하는 금액) 이하인 자,대상자: 만 65세 이상 노인인구의 70% 수준,서류심사,[],"['만 65세 이상', '가구의 소득 인정액이 선정기준액 이하']","가구 유형에 따른 소득 인정액 기준 적용 (단독 가구: 228만 원, 부부 가구: 364.8만 원)",소득 인정액은 월 소득평가액과 재산의 월 소득환산액의 합으로 계산됨. 직역연금 수급자 및 배우자는 대상에서 제외됨.,전국,[],,,,
135200005031,장기요양급여비용 본인부담금 감경,"소득수준에 따라 장기요양급여비용 본인부담금 감경 적용 (감경률 40%, 60% 차등)",보호·돌봄,보건복지부,중앙행정기관,개인,현금(감면),"장기요양급여 이용 후 발생한 급여비용에 대한 수급자의 본인부담비용 감경 - (40% 감경) 가입자 종류 및 가구원수별 산정보험료 순위 25%초과 50%이하인 자 - (60% 감경) 보험료 순위 25%이하인 자, 「의료급여법」제3조제1항제2호부터 제9호까지의 규정에 따른 수급권자, 「국민건강보험법 시행규칙」제15조에 따라 국민건강보험공단으로부터 건강보험 본인부담액 경감 인정을 받은 자 등",방문신청,상시신청,,,국민건강보험공단/1577-1000,https://www.gov.kr/portal/rcvfvrSvc/dtlEx/135200005031,,,,,제한없음,,40.0,,,,있음,,,,,"['장애인', '한부모', '다문화', '북한이탈주민', '기초생활수급자', '차상위계층', '기타']",,"가입자 종류 및 가구원수별 산정보험료 순위 25%초과 50%이하인 자, 보험료 순위 25%이하인 자, 「의료급여법」제3조제1항제2호부터 제9호까지의 규정에 따른 수급권자, 「국민건강보험법 시행규칙」제15조에 따라 국민건강보험공단으로부터 건강보험 본인부담액 경감 인정을 받은 자 등",,서류심사,"['소득증명서', '가족관계증명서']","['소득 수준', '가족 구성원 수']","소득 수준이 기준 이상이어야 하며, 가족 구성원 수가 4명 이하여야 함",건강보험료 등 확인 후 결정,전국,[],,,,
137100000004,관광진흥개발기금 융자지원,관광사업체의 신축 및 개보수를 포함한 시설자금과 운영자금 융자지원,문화·환경,문화체육관광부,중앙행정기관,소상공인||법인/시설/단체,현금(융자),"○ 시설자금 - 신축 : 반기 소요자 금의 100%, 150억원 이내(중견기업, 특급호텔 70%, 75억원) · 관광지, 관광단지, 관광특구 내 시설은 200억 원 이내 - 개보수 : 반기 소요자 금의 100%, 80억원 이내(중견기업, 특급호텔 70%, 40억원) ○ 운영자금 : 최근 1년간 영업비용의 50%, 30억원이내",기타 온라인신청||방문신청,2024.12.30.(월)~2025.5.16(금) / ※ 예산 소진 시 조기 종료될 수 있음,3000000000.0,20000000000.0,관광기금 융자상시지원센터/02-757-7485,https://www.gov.kr/portal/rcvfvrSvc/dtlEx/137100000004,,,,,제한없음,,,,,,제한없음,,,,,[],[],"관광진흥법에 의한 관광사업체 (시설 확충, 운영자금) - 여행업, 호텔업, 휴양업 등 47개 업종, 관광지, 단지 조성 사업 등",,서류심사,[],[],"{'시설자금': '융자 한도 내에서 신청금액 전액(100%)을 배정할 수 있음', '운영자금': '최근 1년간 영업비용의 50%, 30억원 이내 등'}",,전국,[],,,,
137100000006,스포츠 강좌 이용권 지원,저소득층 유·청소년 대상으로 스포츠 강좌 수강료 지원 (1인당 매월 10.5만 원 이내),문화·환경,문화체육관광부,중앙행정기관,개인,이용권,○ 1인당 월 10.5만 원 이내 스포츠강좌 수강료 지원,정부24온라인신청||기타 온라인신청||방문신청,자세한 날짜는 읍면동 주민센터에 따라 다를 수 있음,50000.0,50000.0,국민체육진흥공단(스포츠강좌이용권)/02-410-1298~9,https://www.gov.kr/portal/rcvfvrSvc/dtlEx/137100000006,5.0,18.0,세,,있음,기타,,10.5,만원,,있음,청소년,무관,무관,무관,"['기초생활수급자', '차상위계층', '장애인', '한부모']","['자활근로', '본인부담경감']","차상위 장애, 자활근로, 본인부담경감, 차상위계층 확인서 발급대상(구 우선돌봄차상위)/ 법정 한부모 보호가구",,서류심사,[],[],"1순위 : 신규 및 30개월 미만 이용자 중 생계·의료·주거급여 대상자, 2순위 : 신규 및 30개월 미만 이용자 중 차상위계층, 법정한부모가정 대상자, 3순위 : 30개월 이상 이용자 중 생계·의료·주거급여 대상자, 4순위 : 30개월 이상 이용자 중 차상위계층, 법정한부모가정 대상자",만 5세~만 18세 유·청소년 가구 중 신청자가 없는 경우 동일 연령 차상위계층까지 확대 가능,전국,[],,,,
137100000032,문화로 치유 지원,심리적 상처 치유가 필요한 대상에게 맞춤형 문화예술치유 프로그램 지원,문화·환경,문화체육관광부,중앙행정기관,개인,기타(교육),"경도인지장애 노인, 폭력·범죄 피해 국민 등 대상 문화예술치유 프로그램 제공",기타 온라인신청||방문신청,모집공고 시 제공,,,한국문화예술교육진흥원 가치확산팀/02-6209-5850,https://www.gov.kr/portal/rcvfvrSvc/dtlEx/137100000032,,,,,제한없음,,,,,,제한없음,,,,,"['학폭 피해자', '학폭 가해자', '정신건강 상담수요자', '경도인지장애 및 치매 위험자', '고립 운둔 청년', '심리 정서적 위기 청소년', '문화로 치유지원이 필요한 국민']",[],,,서류심사,[],[],"학폭 피·가해자, 정신건강 상담수요자, 경도인지장애 및 치매 위험자, 고립·운둔 청년, 심리·정서적 위기 청소년, 문화로 치유지원이 필요한 국민",,전국,[],,,,
137100000033,지역자율형 생활체육활동 지원(어르신 체육활동 지원),60세 이상 어르신을 대상으로 한 생활체육교실 운영 및 지자체별 기획사업 추진,문화·환경,문화체육관광부,중앙행정기관,개인,기타(교육)||문화/여가지원,○ 어르신 대상 맞춤형 생활체육교실 운영 ○ 지자체별 어르신 대상 생활체육 기획사업 * 지자체별 사업내용 상이,방문신청,모집공고 시 제공,,,문화체육관광부 스포츠혁신지원과/044-203-31965,https://www.gov.kr/portal/rcvfvrSvc/dtlEx/137100000033,60.0,,세,,있음,,,,,,제한없음,노인,,,,[],[],,,동일,[],[],지원자의 대상이 지원 대상과 동일해야 함,,특정지역,['해당 지역의 시도 체육회 또는 종목단체'],,,어르신 체육활동을 지원하는 지역내 거주자,지역자율형 생활체육활동을 위한 어르신 체육활동을 지원하는 정책
137100000034,장애 체육인 생활지원금 지원,생활이 어려운 장애국가대표선수 및 지도자에게 생활보조비 및 단기훈련비 지원,문화·환경,문화체육관광부,중앙행정기관,개인,현금,"장애 국가대표 선수, 지도자 중 경제적으로 어려운 자(‘국민기초생활 보장법’에 따른 수급자, 차상위계층 등)에게 월 50만 원씩 10개월 지급",방문신청,모집공고 시 제공,500000.0,500000.0,국민체육진흥공단 체육인복지사업팀/02-410-1623,https://www.gov.kr/portal/rcvfvrSvc/dtlEx/137100000034,,,,,제한없음,,,,,,제한없음,,,,,"['장애인', '기초생활수급자']","['국가대표', '지도자']",<국민기초생활보장법>에 따른 수급자 등 경제적으로 어려운 자,,서류심사,[],[],국민체육진흥공단에서 지원하는 각종 지원금을 받지 않은 자를 우선 선정,예산 범위 내에서 규정 요건에 적합한 경우에 선정,전국,[],,,,
