service_id,title,purpose_summary,category,org_name,org_type,applicant_type,support_type,support_desc,apply_method,apply_period,min_amount,max_amount,phone,detail_url,age_min,age_max,age_unit,age_note,age_restriction,income_type,income_percentage,income_amount,income_unit,income_note,income_restriction,target_age_group,target_employment,target_education,target_household,target_special,target_occupation,target_specific_conditions,target_note,selection_method,required_documents,evaluation_criteria,selection_specific_conditions,selection_note,residence_type,specific_regions,residence_duration,residence_duration_unit,residence_specific_conditions,residence_note
131200000002,지방공무원 신규 임용시험 응시 수수료 면제,지방공무원 신규 임용에 응시할 경우 수수료 면제,행정·안전,행정안전부,중앙행정기관,개인,현금(감면),"지방공무원 신규임용시험에 저소득층, 장애인, 2명 이상의 미성년 자녀가 있는 사람이 응시할 경우 응시수수료 면제",기타 온라인신청,상시신청,,,지방자치단체 인터넷원서접수센터/044-205-3345,https://www.gov.kr/portal/rcvfvrSvc/dtlEx/131200000002,,,,,제한없음,,,,,,제한없음,,구직자,,2인가구,['장애인'],[],"지방공무원 신규임용시험에 응시하는 저소득층, 장애인, 2명 이상의 미성년 자녀가 있는 사람",,서류심사,"['가족관계증명서', '소득증빙서류']","['국민기초생활 보장법 수급자', '장애인염금법 수급자', '2명 이상의 미성년 자녀 보유자']",국민기초생활 보장법 또는 한부모가족지원법 또는 장애인염금법에 따른 수급자 또는 지원 대상자여야 함,,전국,[],,,,
131200000004,장애인차량취득세및자동차세감면,장애인이 보철용·생업활동용으로 사용하기 위해 취득하는 자동차 취득세 및 자동차세 감면,행정·안전,행정안전부,중앙행정기관,개인,현금(감면),○ 장애인(「장애인복지법」에 따른 장애인으로서 장애정도가 심한 장애인)이 보철용·생업활동용으로 사용하기 위하여 취득하는 배기량 2천시시 이하인 승용자동차 등으로서 취득세 또는 자동차세 중 어느 하나의 세목에 대하여 먼저 감면 신청하는 1대에 대해서는 취득세 및 자동차세를 각각 2027년 12월 31일까지 면제,방문신청,자세한 날짜는 시군구청에 따라 다를 수 있음,,,지방세 one call 서비스/1577-5700,https://www.gov.kr/portal/rcvfvrSvc/dtlEx/131200000004,,,,,제한없음,,,,,,제한없음,,,,,['장애인'],[],장애인(「장애인복지법」에 따른 장애인으로서 장애정도가 심한 장애인)이 보철용·생업활동용으로 사용하기 위하여 취득하는 자동차에 대한 취득세 및 자동차세 면제 조건,,서류심사,[],[],1대에 대해서는 취득세 및 자동차세를 각각 2027년 12월 31일까지 면제,,전국,[],,,,
131200000005,노인복지시설 지방세 감면,"노인복지시설 설치ㆍ운영을 위해 취득한 부동산의 취득세면제, 재산세경감",행정·안전,행정안전부,중앙행정기관,법인/시설/단체,현금(감면),"○ 노인 복지법에 따라 노인복지시설을 설치ㆍ운영하기 위하여 취득하는 부동산에 대해서는 지방세를 2026년 12월 31일까지 감면 - 「노인복지법」 제31조에 따른 노인여가복지시설ㆍ노인보호전문기관ㆍ노인일자리지원기관ㆍ노인주거복지시설ㆍ노인의료복지시설 또는 재가노인복지시설 등 무료 노인복지시설 사용하는 경우 취득세 면제, 재산세 50/100 경감 등 - 위 노인복지시설 외의 경우 취득세 25/100, 재산세 25/100",방문신청,접수기관 별 상이,,,지방세 상담센터/1577-5700||세종시 지방세상담/044-120,https://www.gov.kr/portal/rcvfvrSvc/dtlEx/131200000005,,,,,제한없음,,,,,,제한없음,노인,,,,[],[],「노인복지법」 제31조에 따른 노인복지시설을 설치ㆍ운영하기 위하여 취득하는 부동산,,서류심사,[],[],「노인복지법」 제31조에 따른 노인복지시설 운영에 필요한 자격 요건을 충족하는 자,,전국,[],,,,
131200000006,국가유공자 등이 대부금으로 취득하는 부동산 취득세 감면,국가유공자 등이 대부금으로 취득하는 부동산에 대하여 취득세 감면,행정·안전,행정안전부,중앙행정기관,개인,현금(감면),○ 부동산 취득세 감면(2026.12.31.한),방문신청,상시신청,,,지방세 one call 서비스/1577-5700,https://www.gov.kr/portal/rcvfvrSvc/dtlEx/131200000006,,,,,제한없음,,,,,,제한없음,,,,,[],[],대부금으로 부동산 취득 -전용면적 85제곱미터 이하인 주택(대부금 초과부분 포함) -전용면적 85제곱미터 이하인 주택 외의 부동산(대부금 초과 부분 제외),,동일,[],[],지원자의 대상이 지원 대상과 동일해야 함,,전국,[],,,,
131200000008,다자녀가구 자동차취득세 감면,다자녀가구가 취득한 자동차 취득세 감면,행정·안전,행정안전부,중앙행정기관,개인,현금(감면),"○ 2027년 12월 31일까지 취득세 감면 ○ 승용자동차 (7~10인승), 승합자동차 (15인승 이하), 화물자동차 (1톤 이하), 배기량 250시시 이하 이륜자동차 면제(다만, 지방세특례제한법 제177조의2에 따라 지방세 감면 특례의 제한 적용) ○ 3자녀 취득세 100%(단, 6인 이하 승용자동차는 140만원 한도) / 2자녀 취득세 50%(단, 6인 이하 승용자동차는 70만원 한도)",방문신청,자세한 날짜는 시군구청에 따라 다를 수 있음,700000.0,1400000.0,지방세 one call 서비스/1577-5700,https://www.gov.kr/portal/rcvfvrSvc/dtlEx/131200000008,18.0,,세,,제한없음,,,,,,제한없음,,,,,[],[],"만18세 미만의 자녀 2명 이상을 양육하는 자(가족관계등록부 기준, 양자 및 배우자 자녀 포함)",,서류심사,[],[],"3자녀 취득세 100%(단, 6인 이하 승용자동차는 140만원 한도) / 2자녀 취득세 50%(단, 6인 이하 승용자동차는 70만원 한도)",,전국,[],,,,
131200000010,영유아 보육시설 지방세 감면,"영육아보육 시설 설치ㆍ운영을 위해 취득한 부동산의 취득세,재산세 면제",행정·안전,행정안전부,중앙행정기관,법인/시설/단체,현금(감면),○ 「영유아보육법」에 따른 어린이집 및 「유아교육법」에 따른 유치원(이하 이 조에서 “유치원등”이라 한다)을 직접 사용하기 위하여 취득하는 부동산 및 「영유아보육법」 제10조제4호에 따른 직장어린이집을 법인ㆍ단체 또는 개인에게 위탁하여 운영하기 위하여 취득하는 부동산에 대해서는 취득세를 2027년 12월 31일까지 면제,방문신청,접수기관 별 상이,,,지방세 상담센터/1577-5700,https://www.gov.kr/portal/rcvfvrSvc/dtlEx/131200000010,,,,,제한없음,,,,,,제한없음,,,,,[],[],"「영유아보육법」에 따른 어린이집 및 「유아교육법」에 따른 유치원 설치ㆍ운영하기 위하여 취득하는 부동산, 「영유아보육법」 제10조제4호에 따른 직장어린이집을 법인ㆍ단체 또는 개인에게 위탁하여 운영하기 위하여 취득하는 부동산",,서류심사,"['법인 등기부등본', '부동산 취득 계획서']","['부동산 위치', '부동산 규모']",어린이집 또는 유치원 설치ㆍ운영을 위한 적합성,,전국,[],,,,
131200000011,국가유공자 단체 등에 대한 지방세 감면,국가유공자 단체가 취득 및 소유한 부동산에 대해 지방세 면제,행정·안전,행정안전부,중앙행정기관,법인/시설/단체,현금(감면),○ 국가유공자 등 단체 설립에 관한 법률에 따라 설립된 국가유공자 단체 등이 취득 및 소유하는 부동산에 대하여 2026년 12월 31일까지 다음의 지방세 면제 - 그 고유업무에 직접 사용하기 위하여 취득하는 부동산에 대한 취득세 - 그 고유업무에 직접 사용하기 위한 면허에 대한 등록면허세 - 과세기준일 현재 그 고유업무에 직접 사용하는 부동산에 대한 재산세(「지방세법」 제112조제1항제2호에 따른 재산세를 포함한다) 및 「지방세법」 제146조제3항에 따른 지역자원시설세 - 해당 단체에 대한 주민세 사업소분(「지방세법」제81조제1항제2호에 따라 부과되는 세액으로 한정한다) 및 종업원분,방문신청,접수기관 별 상이,,,지방세 상담센터/1577-5700||세종시 지방세상담/044-120,https://www.gov.kr/portal/rcvfvrSvc/dtlEx/131200000011,,,,,제한없음,,,,,,제한없음,노인,무관,무관,무관,['기타'],['기타'],국가유공자 등 단체 설립에 관한 법률에 따라 설립된 국가유공자 단체 등이 취득 및 소유하는 부동산,,서류심사,[],[],지원대상과 동일해야 함,,특정지역,[],2026.0,년,국가유공자 등 단체 설립에 관한 법률에 따라 설립된 국가유공자 단체 등이 취득 및 소유하는 부동산에 대하여 2026년 12월 31일까지 다음의 지방세 면제 조건,국가유공자 단체 등이 취득 및 소유하는 부동산에 대한 지방세 면제 조건에 대한 설명
131200000012,사회복지법인 지방세 감면,"사회복지법인 및 단체가 사회복지사업 운영을 위해 취득하는 부동산에 대해 취득세, 재산세 등",행정·안전,행정안전부,중앙행정기관,법인/시설/단체,현금(감면),"○ 「사회복지사업법」에 따른 사회복지법인 등이 사회복지사업에 직접사용하기 위해 취득하는 부동산에 대해 취득세 , 재산세 면제 및 「사회복지시설」을 설치 운영하는 법인 등에 대해 무료, 유료 여부에 따라 취득세 및 재산세 25%~100%를 2025년 12월 31일까지 감면 ○ 사회복지법인 등이 사회복지사업에 직접 사용하는 경우 등록면허세, 주민세 사업소분, 주민세 종업원 분 2025년 12월 31일까지 면제""",방문신청,접수기관 별 상이,,,지방세 상담센터/1577-5700||세종시 지방세상담/044-120,https://www.gov.kr/portal/rcvfvrSvc/dtlEx/131200000012,,,,,제한없음,,25.0,,,,있음,,,,,"['장애인', '한부모', '다문화', '북한이탈주민', '기초생활수급자', '차상위계층', '기타']",[],사회복지사업법에 따라 설립된 사회복지법인과 사회복지사업을 목적으로 하는 단체 및 한국한센복지협회,,동일,[],[],지원자의 대상이 지원 대상과 동일해야 함,,전국,[],,,,
131200000013,사회적기업 지방세 감면,"규모가 중소기업인 사회적기업에 대하여 취득세,재산세 감면",행정·안전,행정안전부,중앙행정기관,법인/시설/단체,현금(감면),"○ 취득세50%, 재산세 25% 감면(2024.12.31.한)",방문신청,접수기관 별 상이,,,지방세 상담센터/1577-5700||세종시 지방세상담/044-120,https://www.gov.kr/portal/rcvfvrSvc/dtlEx/131200000013,,,,,제한없음,기타,25.0,,,,제한없음,,,,,[],[],사회적기업육성법 제2조제1호에 따른 사회적기업(상법에 따른 회사인 경우에는 '중소기업기본법' 제2조제1항에 따른 중소기업으로 한정),,서류심사,[],[],지원대상과 동일한 조건을 충족해야 함,,전국,[],,,,
131200000014,국가유공자 차량취득세 및 자동차세 감면,국가유공자 등이 취득하는 차량에 대한 취득세 및 자동차세 감면,행정·안전,행정안전부,중앙행정기관,개인,현금(감면),"○ 국가유공자등이 보철용·생업활동용으로 사용하기 위하여 취득하는 다음 각호의 어느 하나에 해당하는 자동차로서 취득세 또는 자동차세 중 어느 하나의 세목(稅目)에 대하여 먼저 감면을 신청하는 1대에 대해서는 취득세와 자동차세를 각각 2024년 12월 31일까지 면제, 보훈보상대상자 및 지원대상자의 경우 취득세·자동차세 50% 2024년 12월 31일까지 각각 경감 -다음 각 목의 어느 하나에 해당하는 승용 자동차 · 배기량 2천시시 이하인 승용 자동차 · 자동차관리법에 따라 승용자동차로 분류된 자동차 중 승차 정원 7명 이상 10명 이하인 승용 자동차 · 자동차관리법에 따라 자동차의 구분 기준이 화물자동차에서 2006년 1월 1일부터 승용 자동차에 해당하게 되는 자동차(2005년 12월 31일 이전부터 승용 자동차로 분류되어 온 것은 제외한다) · 승차 정원 15명 이하인 승합자동차 · 최대적재량 1톤 이하인 화물자동차 · 배기량 250시시 이륜자동차",방문신청,자세한 날짜는 시군구청에 따라 다를 수 있음,,,지방세 one call 서비스/1577-5700,https://www.gov.kr/portal/rcvfvrSvc/dtlEx/131200000014,,,,,제한없음,,,,,,제한없음,,,,,"['국가유공자', '5ㆍ18민주화운동부상자', '고엽제후유의증환자', '보훈보상대상자']",,"국가유공자, 5ㆍ18민주화운동부상자, 고엽제후유의증환자, 보훈보상대상자",자동차 취득세 및 자동차세 감면 대상,서류심사,"['국가유공자 등 예우 및 지원에 관한 법률 증명서', '신분증']",['상이등급 1급부터 7급까지의 판정을 받은 국가 유공자'],5ㆍ18민주화운동부상자로서 신체장해등급 1급부터 14급까지의 판정을 받은 사람은 우선 선정,,전국,[],,,,
132000000001,외국인 범죄 예방교실 운영 지원,국내 체류 외국인에게 법규에 대한 상담 및 교육 프로그램 제공,행정·안전,경찰청,중앙행정기관,개인,기타(교육)||기타(상담)||상담/법률지원,○ 국내 법규 교육 및 상담 - 외국인 근로자/유학생: 기초질서법 교육 - 결혼이주여성 및 배우자: 가정폭력(아동학대) 등 범죄예방 교육 - 다문화가정 자녀: 학교폭력 예방 교육,방문신청,접수기관 별 상이,,,경찰민원콜센터/182,https://www.gov.kr/portal/rcvfvrSvc/dtlEx/132000000001,,,,,제한없음,,,,,,제한없음,,,,,[],[],국내 체류 외국인,,자격조건 확인,[],[],국내 체류 중인 외국인,,전국,[],,,,
132000000002,다문화 가족 및 취약계층 대상 운전면허교실 운영 지원,다문화 가족 및 취약계층 대상으로 운전면허교실 운영 지원,행정·안전,경찰청,중앙행정기관,개인,기타(교육),"○ 교통사고예방, 사고 발생 시 요령 등 실생활에 필요한 내용 중심으로 운전면허 학과 교육 진행 ○ 운전면허교실 교재(DVD) 구매 및 운전면허시험 문제은행 책자 제작 등 운영예산 및 교재 확대 지원 ○ 전문적이고 체계적인 교육 실시를 위해 도로교통공단 등과 협조로 전문 강사 확보 및 언어권별 통역을 지정 ○ 교육 이수자 친교 모임 활성화 ○ 국적별, 지역별 네트워크 구축 및 정보교환 등 상호 지원 유도 ○ 면허 취득자를 면허교실 통역 강사로 활용, 언어불통 해소",방문신청,접수기관에 문의,,,경찰민원콜센터/182,https://www.gov.kr/portal/rcvfvrSvc/dtlEx/132000000002,,,,,제한없음,,,,,,제한없음,,외국인 근로자,,,"['이주여성', '실질적인 사회 정착 지원 필요']",[],국내 체류 외국인 중 이주여성 및 외국인 근로자 중심으로 실질적인 사회 정착 지원이 필요한 대상,,서류심사,[],[],국내 체류 중인 외국인,,전국,[],,,운전면허 교육 및 교육자료 확대 및 지원,
132000000003,외국인 피해자 지원제도 안내·연계 서비스,체류 외국인 대상으로 도움센터 운영(전국 약 394개소),행정·안전,경찰청,중앙행정기관,개인,기타(상담)||상담/법률지원,"○ 외국인이 자유롭게 출입하는 다문화 가족지원센터, NGO 단체 등 전국 394개소 지정 운영, 법률 지원(상담) 피해 구조",방문신청,접수기관에 문의,,,경찰민원콜센터/182,https://www.gov.kr/portal/rcvfvrSvc/dtlEx/132000000003,,,,,제한없음,,,,,,제한없음,,,,,[],[],국내 체류 외국인,,자격조건 확인,[],[],국내 체류 중인 외국인,,전국,[],,,,
132000000006,운전면허 적성검사 간소화 서비스 제공,조건에 부합하는 1종보통 운전면허 적성검사 대상자에게 신체검사 수수료 감면 제공,행정·안전,경찰청,중앙행정기관,개인,현금(감면),"○ 1종 보통 면허 적성검사 갱신의 경우, 2년 이내 신체검사를 받은 검진기록이 있을 경우, 정보 제공에 동의하면 신체검사 수수료를 절감",기타 온라인신청||방문신청,적성검사(갱신) 기간 내,,,도로교통공단/1577-1120,https://www.gov.kr/portal/rcvfvrSvc/dtlEx/132000000006,,,,,제한없음,,,,,,제한없음,,,,,[],[],1종 보통 운전면허 적성검사 대상에게 신체검사 수수료 감면 제공,,서류심사,[],[],지원대상과 동일해야 함,,전국,[],,,,
132000000008,범죄피해자 보호·지원,강력범죄 피해자 대상 안전조치 실시 및 지원제도 연계,행정·안전,경찰청,중앙행정기관,개인,기타||기타(상담)||상담/법률지원||의료지원||현물,"○ 범죄피해자 안전조치 - 사건 내용 및 위험도에 따라 긴급신고용 스마트워치, 주거지 CCTV 설치, 임시숙소 등 지원 ○ 심리적 지원 - 피해발생 직후 경찰단계 응급심리상담 - 법무부(스마일센터), 범죄피해자지원센터 등 관계기관 협업을 통한 장기 심리상담 연계 ○ 경제적 지원 - 검찰 범죄피해자 구조금 및 치료비·생계비 지원제도 연계 - 지방자치단체 및 피해자 지원 민간단체 협업을 통한 긴급 치료비·생계비 지원제도 연계",방문신청,접수기관에 문의,,,경찰민원콜센터/182,https://www.gov.kr/portal/rcvfvrSvc/dtlEx/132000000008,,,,,제한없음,,,,,,제한없음,,,,,[],[],강력범죄 피해자,,서류심사,[],[],강력범죄 피해자 여부,,전국,[],,,,
132000000009,참고인 여비 지급,경찰관서에 출석한 범죄수사 참고인 등에게 여비 지급,행정·안전,경찰청,중앙행정기관,개인,상담/법률지원||현금,○ 범죄수사를 위하여 사법경찰관의 출석요구를 받고 경찰관서에 출석한 참고인에게 비용 지급,방문신청,국가재정법 제96조 국가에대한 일반적 채권시효 5년 준용,,,경찰민원콜센터/182,https://www.gov.kr/portal/rcvfvrSvc/dtlEx/132000000009,,,,,제한없음,,,,,,제한없음,,,,,[],['범죄 수사 참고인'],,,서류심사,[],[],지급하지 아니할 수 있는 경우를 제외,,전국,[],,,,
134200000003,교육급여,초중고 학생에게 교육활동지원비 지원(초중고 학생별 차등지급),보육·교육,교육부,중앙행정기관,개인,이용권,"2024.3월부터 적용 ○ 교육활동지원비 - 초등학생 : 1인당 461,000원(연 1회) - 중학생: 1인당 654,000원(연 1회) - 고등학생 : 1인당 727,000원(연 1회) ○ 교과서대, 입학금 및 수업료 : 전액 지급(연도별, 급지별 학교장이 고지한 금액 전부) ※ 무상교육 제외학교 재학시 지급 ※ 교과서는 해당 학년의 정규 교육과정에 편성된 교과목의 교과서 전체(연 1회)",기타 온라인신청||방문신청,상시신청,461000.0,727000.0,보건복지상담센터/129||교육비원클릭 신청시스템 상담센터/1544-9654,https://www.gov.kr/portal/rcvfvrSvc/dtlEx/134200000003,,,,,제한없음,중위소득,50.0,,,,있음,,학생,,,['기초생활수급자'],[],국민기초생활 보장법 제12조에 따라 소득 인정액이 기준 중위소득의 100분의 50 이하인 사람으로 - 다음 각호의 학교 또는 시설에 입학 또는 재학하는 자,초·중등교육법 제2조세1호에 따른 초등학교·공민학교 · 초·중등교육법 제2조세2호의 규정에 의한 중학교·고등공민학교 · 초·중등교육법 제2조세3호의 규정에 의한 고등학교·고등기술학교 · 초·중등교육법 제2조세4호의 규정에 의한 특수학교 · 초·중등교육법 제2조세5호의 규정에 의한 각종학교로서 제1호 내지 제4호와 유사한 학교 · 평생교육법 제31조에 따른 학교 형태의 평생교육 시설(고등학교 졸업 이하의 학력이 인정되는 시설에 한함),소득 인정액 기준,[],['가구 규모별 기준 중위소득의 50%와 비교'],수급자 선정 및 급여액 결정을 위한 소득 인정액 계산 방법 포함,,전국,[],,,,
134200000006,국립특수학교 및 국립부설학교 특수학급 지원,"방과후학교, 늘봄학교, 돌봄교실, 통학비 및 치료지원비 지원 등 교수학습 활동 지원",보육·교육,교육부,중앙행정기관,개인,기타,"방과후학교, 늘봄학교, 돌봄교실, 통학비 및 치료지원비 지원 등 교수학습 활동 지원",방문신청,상시신청,,,교육부 특수교육정책과/044-203-6569,https://www.gov.kr/portal/rcvfvrSvc/dtlEx/134200000006,,,,,제한없음,,,,,,제한없음,,,,,['장애인'],,"국립특수학교, 국립대학부설유치원 및 학교 배치 특수교육대상자",,서류심사,"['서류1', '서류2']",[],학생 * 장애인 등에 대한 특수교육법 제15조에 따라 시도교육청 교육감(장)에 의해 선정,,전국,[],,,,
134200000007,대학원 학과 기반 교육연구단 연구장학금 등 지원(4단계 두뇌한국21 사업),"대학원 학과기반 사업단 소속 대학원생에 연구장학금, 산학협력 활동지원비 등 지급",보육·교육,교육부,중앙행정기관,개인,현금(장학금),"○ 대학원생 연구장학금, 신진 연구인력 인건비, 국제화 경비, 실험실습비 및 산학협력 활동 지원비",방문신청,접수기관 별 상이,,,BK21사업팀/042-869-6447,https://www.gov.kr/portal/rcvfvrSvc/dtlEx/134200000007,,,,,제한없음,,,,,,제한없음,,,대학원,,[],[],대학원 학과를 기반으로 구성된 교육연구단(팀),,평가,[],"['교육연구단(팀)의 연구계획서 평가', '연구장학금 수혜 대상 선발 기준 평가']","연구계획서의 창의성, 실현가능성, 사업비 사용 계획 등을 종합적으로 평가",평가 및 선정 완료 후 연구장학금 수혜 대상 선발 및 지원,전국,[],,,,
134200000008,글로벌 현장학습 프로그램 운영,"대학생에게 글로벌 현장학습을 위한 항공료, 보험료, 체재비 등을 지원",보육·교육,교육부,중앙행정기관,개인,기타(교육)||현금,"○ (재정지원) 항공료, 비자 발급비, 보험료, 체재비(일부) 등 지원 * 파견국가, 기간 등에 따라 차등지원 * 체제비의 경우 학생 자비부담이 원칙이나, 소득수준 등을 고려하여 일부 지원 ○ (프로그램) 사전교육-해외현지 연수-사후관리 (내역사업별로 상이) * 사전교육: 사전멘토링, 어학, 안전, 직무교육 등 * 해외연수: 현지적응교육, 어학, 산업체 현장실습, 인턴십 등 * 사후관리: 어학향상 진단, 글로벌 역량 진단, 취업멘토링 등",기타 온라인신청,사업별 공고 확인,,,전문대학 글로벌 현장학습/02-3145-1252||한미대학생연수(WEST)/02-3668-1307||한일대학생연수/053-238-2991||파란사다리/053-238-2971,https://www.gov.kr/portal/rcvfvrSvc/dtlEx/134200000008,,,,,제한없음,,,,,,제한없음,청년,학생,대학졸업,무관,[],[],"대학생 및 전문대학생 (일반대학 4학기, 전문대학 2학기 이상 수료자)",,서류심사 및 면접,"['학적부', '성적증명서', '자기소개서', '추천서']","['학업성취도', '어학능력', '인성']","한일대학생연수의 경우, 국외 현장학습을 위한 일본어 구사 능력 필수",서류심사 통과자에 한해 면접 진행,전국,[],,,,
134200000010,장애학생 가족 참여 국외체험 연수 지원,"특수교육대상 중고등학생 및 가족, 특수교사 등에게 국외체험연수 기회 제공",보육·교육,교육부,중앙행정기관,개인,기타(교육)||문화/여가지원,"○ 특수교육대상 중고등학생과 가족, 특수교사에게 국외체험연수의 기회 제공",직접입력,접수기관 별 상이,,,교육부 국립특수교육원 연수과/041-537-1465,https://www.gov.kr/portal/rcvfvrSvc/dtlEx/134200000010,,,,,제한없음,,,,,,제한없음,,,,,['장애인'],['특수교사'],특수교육대상 중고등학교학생 및 학생의 보호자,,추첨,[],[],"시도교육청에서 대상 학생, 보호자, 특수교사 추천",,전국,[],,,,
