service_id,title,purpose_summary,category,org_name,org_type,org_code,applicant_type,support_type,support_desc,target_desc,apply_method,apply_period,apply_from,apply_to,phone,detail_url,created_at,updated_at,views,min_amount,max_amount,raw,cond_target,cond_selection,cond_age,cond_income,cond_residence,cond_eligibility
140000000187,산촌생태마을 운영매니저 일자리 제공,산촌생태마을 등을 대상으로 운영매니저에 대한 인건비를 보조,고용·창업,산림청,중앙행정기관,1400000,개인,현금,"○ 산촌 생태마을 운영매니저 인건비 보조(국비50%, 지방비50%)",○ 산촌생태마을 또는 산촌생태마을협의회,방문신청,접수기관 별 상이,,,해당지역 시군구청/042-481-4245,https://www.gov.kr/portal/rcvfvrSvc/dtlEx/140000000187,20201217142613,20250425094640,5394,,,"{""list"": {""등록일시"": ""20201217142613"", ""부서명"": ""산림휴양치유과"", ""사용자구분"": ""개인"", ""상세조회URL"": ""https://www.gov.kr/portal/rcvfvrSvc/dtlEx/140000000187"", ""서비스ID"": ""140000000187"", ""서비스명"": ""산촌생태마을 운영매니저 일자리 제공"", ""서비스목적요약"": ""산촌생태마을 등을 대상으로 운영매니저에 대한 인건비를 보조"", ""서비스분야"": ""고용·창업"", ""선정기준"": ""○ 산촌생태마을을 관리, 운영할 수 있는 만18세 이상인 자로서 상근직으로 업무가 가능한 자\r\n\r\n○ 동일한 조건인 경우 매니저 교육과정 이수자, 산림관련 자격증 소지자 등을 우선적으로 채용"", ""소관기관명"": ""산림청"", ""소관기관유형"": ""중앙행정기관"", ""소관기관코드"": ""1400000"", ""수정일시"": ""20250425094640"", ""신청기한"": ""접수기관 별 상이"", ""신청방법"": ""방문신청"", ""전화문의"": ""해당지역 시군구청/042-481-4245"", ""접수기관"": ""시·군·구청"", ""조회수"": 5394, ""지원내용"": ""○ 산촌 생태마을 운영매니저 인건비 보조(국비50%, 지방비50%)"", ""지원대상"": ""○ 산촌생태마을 또는 산촌생태마을협의회"", ""지원유형"": ""현금""}, ""detail"": null, ""cond"": null}",○ 산촌생태마을 또는 산촌생태마을협의회,"○ 산촌생태마을을 관리, 운영할 수 있는 만18세 이상인 자로서 상근직으로 업무가 가능한 자 ○ 동일한 조건인 경우 매니저 교육과정 이수자, 산림관련 자격증 소지자 등을 우선적으로 채용",만18세 이상,,해당지역 시군구청/042-481-4245,
140000000189,백두대간 산림소유자 소득감소분 지원,백두대간 산림소유자가 벌채 유보를 할 시 소득감소분에 대해 보전지원,농림축산어업,산림청,중앙행정기관,1400000,개인,현금,○ 입목을 벌채하여 판매할 경우에 얻을 수 있는 예상수익금의 이자상당액,○ (백두대간법 제11조의2 제1항 제5호) 백두대간의 생태계ㆍ자연경관의 보전 또는 산림의 보호·육성을 위하여 벌채를 하지 아니하는 자 등 대통령령으로 정하는 요건에 해당하는 자 ○ (백두대간법 시행령 제11조의3) - 보호지역 지정 당시 산지관리법 제4조제1항제1호 나목의 규정에 의한 공익용산지 또는 산림자원법시행령 제41조에 다른 입목벌채제한지역 안에 있지 아니할 것 - 입목의 평균 수령이 산림자원법시행령 제9조제3항에 따른 기준벌기령 이상일 것,방문신청,접수기관 별 상이,,,해당지역 시군구청/000-0000-0000,https://www.gov.kr/portal/rcvfvrSvc/dtlEx/140000000189,20201217142613,20250731155400,1249,,,"{""list"": {""등록일시"": ""20201217142613"", ""부서명"": ""산림생태복원과"", ""사용자구분"": ""개인"", ""상세조회URL"": ""https://www.gov.kr/portal/rcvfvrSvc/dtlEx/140000000189"", ""서비스ID"": ""140000000189"", ""서비스명"": ""백두대간 산림소유자 소득감소분 지원"", ""서비스목적요약"": ""백두대간 산림소유자가 벌채 유보를 할 시 소득감소분에 대해 보전지원"", ""서비스분야"": ""농림축산어업"", ""선정기준"": ""○ 백두대간의 생태계ㆍ자연경관의 보전 또는 산림의 보호·육성을 위하여 벌채를 하지 아니하는 자 등 대통령령으로 정하는 요건에 해당하는 자"", ""소관기관명"": ""산림청"", ""소관기관유형"": ""중앙행정기관"", ""소관기관코드"": ""1400000"", ""수정일시"": ""20250731155400"", ""신청기한"": ""접수기관 별 상이"", ""신청방법"": ""방문신청"", ""전화문의"": ""해당지역 시군구청/000-0000-0000"", ""접수기관"": ""산림소재지 관할 시.군 산림부서"", ""조회수"": 1249, ""지원내용"": ""○ 입목을 벌채하여 판매할 경우에 얻을 수 있는 예상수익금의 이자상당액"", ""지원대상"": ""○ (백두대간법 제11조의2 제1항 제5호) 백두대간의 생태계ㆍ자연경관의 보전 또는 산림의 보호·육성을 위하여 벌채를 하지 아니하는 자 등 대통령령으로 정하는 요건에 해당하는 자\r\n\r\n○ (백두대간법 시행령 제11조의3)\r\n - 보호지역 지정 당시 산지관리법 제4조제1항제1호 나목의 규정에 의한 공익용산지 또는 산림자원법시행령 제41조에 다른 입목벌채제한지역 안에 있지 아니할 것\r\n - 입목의 평균 수령이 산림자원법시행령 제9조제3항에 따른 기준벌기령 이상일 것"", ""지원유형"": ""현금""}, ""detail"": null, ""cond"": null}",○ (백두대간법 제11조의2 제1항 제5호) 백두대간의 생태계ㆍ자연경관의 보전 또는 산림의 보호·육성을 위하여 벌채를 하지 아니하는 자 등 대통령령으로 정하는 요건에 해당하는 자 ○ (백두대간법 시행령 제11조의3) - 보호지역 지정 당시 산지관리법 제4조제1항제1호 나목의 규정에 의한 공익용산지 또는 산림자원법시행령 제41조에 다른 입목벌채제한지역 안에 있지 아니할 것 - 입목의 평균 수령이 산림자원법시행령 제9조제3항에 따른 기준벌기령 이상일 것,○ 백두대간의 생태계ㆍ자연경관의 보전 또는 산림의 보호·육성을 위하여 벌채를 하지 아니하는 자 등 대통령령으로 정하는 요건에 해당하는 자,,,해당지역 시군구청/000-0000-0000,
140000000191,숲가꾸기 사업 지원,숲가꾸기를 희망하는 산림소유자를 대상으로 건강한 숲이 자랄 수 있도록 조성 지원,농림축산어업,산림청,중앙행정기관,1400000,개인,현금,"○ 국고보조금 지원 대상 숲가꾸기사업 - 풀베기, 덩굴제거, 어린나무가꾸기, 솎아베기, 산불예방숲가꾸기, 공익림가꾸기 등",숲가꾸기를 희망하는 산림소유자,기타 온라인신청||방문신청,연중,,,산림청 산림자원과/042-481-4157,https://www.gov.kr/portal/rcvfvrSvc/dtlEx/140000000191,20201217142613,20250425093348,4100,,,"{""list"": {""등록일시"": ""20201217142613"", ""부서명"": ""산림자원과"", ""사용자구분"": ""개인"", ""상세조회URL"": ""https://www.gov.kr/portal/rcvfvrSvc/dtlEx/140000000191"", ""서비스ID"": ""140000000191"", ""서비스명"": ""숲가꾸기 사업 지원"", ""서비스목적요약"": ""숲가꾸기를 희망하는 산림소유자를 대상으로 건강한 숲이 자랄 수 있도록 조성 지원"", ""서비스분야"": ""농림축산어업"", ""선정기준"": ""○ 산림청의 지속가능한 산림자원 관리 지침 참고 (목차: V.5. 국고보조금 지원 대상 산림사업 -> 나. 숲가꾸기 )"", ""소관기관명"": ""산림청"", ""소관기관유형"": ""중앙행정기관"", ""소관기관코드"": ""1400000"", ""수정일시"": ""20250425093348"", ""신청기한"": ""연중"", ""신청방법"": ""기타 온라인신청||방문신청"", ""전화문의"": ""산림청 산림자원과/042-481-4157"", ""접수기관"": ""시·군·구청"", ""조회수"": 4100, ""지원내용"": ""○ 국고보조금 지원 대상 숲가꾸기사업\r\n - 풀베기, 덩굴제거, 어린나무가꾸기, 솎아베기, 산불예방숲가꾸기, 공익림가꾸기 등"", ""지원대상"": ""숲가꾸기를 희망하는 산림소유자"", ""지원유형"": ""현금""}, ""detail"": null, ""cond"": null}",숲가꾸기를 희망하는 산림소유자,○ 산림청의 지속가능한 산림자원 관리 지침 참고 (목차: V.5. 국고보조금 지원 대상 산림사업 -> 나. 숲가꾸기 ),,,,
140000000192,조림 지원,산림소유자가 조림 희망 시 이에 소요되는 사업비를 지원,문화·환경,산림청,중앙행정기관,1400000,개인,현금(융자),○ 경제림조성 사업비 지원(국비60% : 지방비30% : 자부담10%),○ 조림을 희망하는 산림소유자,방문신청,연중,,,산림청 산림자원과/042-481-1205||서울특별시 자연생태과/02-2133-2161||부산광역시 산림정책과/051-888-3861||대구광역시 산림녹지과/053-803-8724||인천광역시 녹지정책과/032-440-3684||대전광역시 산림녹지정책과/042-270-5557||울산광역시 녹지공원과/052-229-3355||세종특별자치시 산림공원과/044-300-4415||경기도 산림녹지과/031-8030-3562||강원특별자치도 산림정책과/033-249-3153||충청북도 산림녹지과/043-220-3802||충청남도 산림자원과/041-635-4507||전라북도특별자치도 산림자원과/063-280-2663||전라남도 산림자원과/061-286-7531||경상북도 산림정책과/054-880-3602||경상남도 산림관리과/055-211-6824||제주특별자치도 산림녹지과/064-710-6772,https://www.gov.kr/portal/rcvfvrSvc/dtlEx/140000000192,20201217142613,20250425093521,1417,,,"{""list"": {""등록일시"": ""20201217142613"", ""부서명"": ""산림자원과"", ""사용자구분"": ""개인"", ""상세조회URL"": ""https://www.gov.kr/portal/rcvfvrSvc/dtlEx/140000000192"", ""서비스ID"": ""140000000192"", ""서비스명"": ""조림 지원"", ""서비스목적요약"": ""산림소유자가 조림 희망 시 이에 소요되는 사업비를 지원"", ""서비스분야"": ""문화·환경"", ""선정기준"": ""○ 산림에 조림을 실행하는 자"", ""소관기관명"": ""산림청"", ""소관기관유형"": ""중앙행정기관"", ""소관기관코드"": ""1400000"", ""수정일시"": ""20250425093521"", ""신청기한"": ""연중"", ""신청방법"": ""방문신청"", ""전화문의"": ""산림청 산림자원과/042-481-1205||서울특별시 자연생태과/02-2133-2161||부산광역시 산림정책과/051-888-3861||대구광역시 산림녹지과/053-803-8724||인천광역시 녹지정책과/032-440-3684||대전광역시 산림녹지정책과/042-270-5557||울산광역시 녹지공원과/052-229-3355||세종특별자치시 산림공원과/044-300-4415||경기도 산림녹지과/031-8030-3562||강원특별자치도 산림정책과/033-249-3153||충청북도 산림녹지과/043-220-3802||충청남도 산림자원과/041-635-4507||전라북도특별자치도 산림자원과/063-280-2663||전라남도 산림자원과/061-286-7531||경상북도 산림정책과/054-880-3602||경상남도 산림관리과/055-211-6824||제주특별자치도 산림녹지과/064-710-6772"", ""접수기관"": ""시·군·구청"", ""조회수"": 1417, ""지원내용"": ""○ 경제림조성 사업비 지원(국비60% : 지방비30% : 자부담10%)"", ""지원대상"": ""○ 조림을 희망하는 산림소유자"", ""지원유형"": ""현금(융자)""}, ""detail"": null, ""cond"": null}",○ 조림을 희망하는 산림소유자,○ 산림에 조림을 실행하는 자,,,,
140000000194,목재이용명예 감시원 일자리 제공,목재감시활동을 수행하는 자원봉사자 등을 대상으로 활동수당 및 교육비 등 지원,행정·안전,산림청,중앙행정기관,1400000,개인,봉사/기부||현금,"○ 활동수당(5만원/1일), 교육비, 여비, 감시 물품 등 지원 ○ 2024년부터 목재이용명예감시원 미운영(관련 예산 없음)",○ 소비자·생산자 단체 및 비영리법인의 회원·직원(장의 추천) ○ 자원봉사자(목재제품의 유통에 관심이 있는 자 등) ○ 산림청의 설립허가를 받은 법인의 회원·직원(법인의 장 추천),방문신청,지방산림청(국유림관리소)별로 모집(2~3월)(2024년 미운영),,,산림청 민원대표번호/1588-3249,https://www.gov.kr/portal/rcvfvrSvc/dtlEx/140000000194,20201217142613,20250731090144,1420,50000.0,50000.0,"{""list"": {""등록일시"": ""20201217142613"", ""부서명"": ""목재산업과"", ""사용자구분"": ""개인"", ""상세조회URL"": ""https://www.gov.kr/portal/rcvfvrSvc/dtlEx/140000000194"", ""서비스ID"": ""140000000194"", ""서비스명"": ""목재이용명예 감시원 일자리 제공"", ""서비스목적요약"": ""목재감시활동을 수행하는 자원봉사자 등을 대상으로 활동수당 및 교육비 등 지원"", ""서비스분야"": ""행정·안전"", ""선정기준"": ""○ 소비자 생산자 단체 및 비영리법인의 회원, 직원 중 해당 단체 및 법인 장의 추천을 받은자, 자원봉사자"", ""소관기관명"": ""산림청"", ""소관기관유형"": ""중앙행정기관"", ""소관기관코드"": ""1400000"", ""수정일시"": ""20250731090144"", ""신청기한"": ""지방산림청(국유림관리소)별로 모집(2~3월)(2024년 미운영)"", ""신청방법"": ""방문신청"", ""전화문의"": ""산림청 민원대표번호/1588-3249"", ""접수기관"": ""사업을 추진하는 지방산림청(국유림관리소)"", ""조회수"": 1420, ""지원내용"": ""○ 활동수당(5만원/1일), 교육비, 여비, 감시 물품 등 지원\r\n○ 2024년부터 목재이용명예감시원 미운영(관련 예산 없음)"", ""지원대상"": ""○ 소비자·생산자 단체 및 비영리법인의 회원·직원(장의 추천)\r\n\r\n○ 자원봉사자(목재제품의 유통에 관심이 있는 자 등)\r\n\r\n○ 산림청의 설립허가를 받은 법인의 회원·직원(법인의 장 추천)"", ""지원유형"": ""봉사/기부||현금""}, ""detail"": null, ""cond"": null}",○ 소비자·생산자 단체 및 비영리법인의 회원·직원(장의 추천) ○ 자원봉사자(목재제품의 유통에 관심이 있는 자 등) ○ 산림청의 설립허가를 받은 법인의 회원·직원(법인의 장 추천),"○ 소비자 생산자 단체 및 비영리법인의 회원, 직원 중 해당 단체 및 법인 장의 추천을 받은자, 자원봉사자",,,,
140000000201,임도 지원,지자체를 대상으로 임도계획 및 설치에 따른 예산 지원,농림축산어업,산림청,중앙행정기관,1400000,법인/시설/단체,기타,"○ 국고 70%, 지방비 20%, 자부담 10% - 임도신설 · 간선임도 : 278백만원/km · 산불진화임도 : 334백만원/km","○ 지방자치단체(시.도, 시.군.구)",방문신청,접수기관 별 상이,,,산림청 민원대표번호/1588-3249,https://www.gov.kr/portal/rcvfvrSvc/dtlEx/140000000201,20201217142613,20250731091122,1371,,,"{""list"": {""등록일시"": ""20201217142613"", ""부서명"": ""목재산업과"", ""사용자구분"": ""법인/시설/단체"", ""상세조회URL"": ""https://www.gov.kr/portal/rcvfvrSvc/dtlEx/140000000201"", ""서비스ID"": ""140000000201"", ""서비스명"": ""임도 지원"", ""서비스목적요약"": ""지자체를 대상으로 임도계획 및 설치에 따른 예산 지원"", ""서비스분야"": ""농림축산어업"", ""선정기준"": ""지원대상과 동일"", ""소관기관명"": ""산림청"", ""소관기관유형"": ""중앙행정기관"", ""소관기관코드"": ""1400000"", ""수정일시"": ""20250731091122"", ""신청기한"": ""접수기관 별 상이"", ""신청방법"": ""방문신청"", ""전화문의"": ""산림청 민원대표번호/1588-3249"", ""접수기관"": ""시·군·구청"", ""조회수"": 1371, ""지원내용"": ""○ 국고 70%, 지방비 20%, 자부담 10%\r\n - 임도신설\r\n  · 간선임도 : 278백만원/km\r\n  · 산불진화임도 : 334백만원/km"", ""지원대상"": ""○ 지방자치단체(시.도, 시.군.구)"", ""지원유형"": ""기타""}, ""detail"": null, ""cond"": null}","○ 지방자치단체(시.도, 시.군.구)",지원대상과 동일,,,,
140000000202,임산물 수출 지원,"임산물 수출업체 및 생산자가 박람회, 해외판촉 등에 참여할 수 있도록 지원",농림축산어업,산림청,중앙행정기관,1400000,법인/시설/단체,현금,"○ 박람회, 해외판촉, 바이어 초청, 수출패키지 지원, 포장디자인 개발, 안전성 관리, 기계장비 구입, 수출협의회 및 통합조직 육성, 수출선도조직, 수출특화시설 지원 등",○ 임산물 수출업체 및 생산자,방문신청,지원사업별 공모기간에 따름,,,산림청 민원대표번호/1588-3249,https://www.gov.kr/portal/rcvfvrSvc/dtlEx/140000000202,20201217142613,20250801133734,1224,,,"{""list"": {""등록일시"": ""20201217142613"", ""부서명"": ""임업수출교역팀"", ""사용자구분"": ""법인/시설/단체"", ""상세조회URL"": ""https://www.gov.kr/portal/rcvfvrSvc/dtlEx/140000000202"", ""서비스ID"": ""140000000202"", ""서비스명"": ""임산물 수출 지원"", ""서비스목적요약"": ""임산물 수출업체 및 생산자가 박람회, 해외판촉 등에 참여할 수 있도록 지원"", ""서비스분야"": ""농림축산어업"", ""선정기준"": ""○ 수출실적 등"", ""소관기관명"": ""산림청"", ""소관기관유형"": ""중앙행정기관"", ""소관기관코드"": ""1400000"", ""수정일시"": ""20250801133734"", ""신청기한"": ""지원사업별 공모기간에 따름"", ""신청방법"": ""방문신청"", ""전화문의"": ""산림청 민원대표번호/1588-3249"", ""접수기관"": ""산림청"", ""조회수"": 1224, ""지원내용"": ""○ 박람회, 해외판촉, 바이어 초청, 수출패키지 지원, 포장디자인 개발, 안전성 관리, 기계장비 구입, 수출협의회 및 통합조직 육성, 수출선도조직, 수출특화시설 지원 등"", ""지원대상"": ""○ 임산물 수출업체 및 생산자"", ""지원유형"": ""현금""}, ""detail"": null, ""cond"": null}",○ 임산물 수출업체 및 생산자,○ 수출실적 등,,,,
140000000204,산사태현장예방단 일자리 제공,산사태 예방·대응 활동을 위한 산사태현장예방단 일자리 제공,고용·창업,산림청,중앙행정기관,1400000,개인,현금,"○ 임금 : 73,280원/일 ○ 주요업무 - 산사태취약지역 현장점검 및 응급조치 - 산사태취약지역 내 주민 대상 행동요령 홍보 및 대피 지원","○ 만20세 이상인 자로서 정기소득이 없는자 - (우선순위) 취업취약계층, 관할 지역주민으로 해당 지역 지리를 잘 아는자 등",방문신청,수행 기관 공고에 따름,,,산림청 민원대표번호/1588-3249,https://www.gov.kr/portal/rcvfvrSvc/dtlEx/140000000204,20201217142613,20250425094746,3486,73280.0,73280.0,"{""list"": {""등록일시"": ""20201217142613"", ""부서명"": ""산사태방지과"", ""사용자구분"": ""개인"", ""상세조회URL"": ""https://www.gov.kr/portal/rcvfvrSvc/dtlEx/140000000204"", ""서비스ID"": ""140000000204"", ""서비스명"": ""산사태현장예방단 일자리 제공"", ""서비스목적요약"": ""산사태 예방·대응 활동을 위한 산사태현장예방단 일자리 제공"", ""서비스분야"": ""고용·창업"", ""선정기준"": ""○ 서류전형 및 면접"", ""소관기관명"": ""산림청"", ""소관기관유형"": ""중앙행정기관"", ""소관기관코드"": ""1400000"", ""수정일시"": ""20250425094746"", ""신청기한"": ""수행 기관 공고에 따름"", ""신청방법"": ""방문신청"", ""전화문의"": ""산림청 민원대표번호/1588-3249"", ""접수기관"": ""산림청 소속기관(국유림관리소), 지자체(시ㆍ군ㆍ구) 산림부서"", ""조회수"": 3486, ""지원내용"": ""○ 임금 : 73,280원/일\r\n○ 주요업무\r\n  - 산사태취약지역 현장점검 및 응급조치\r\n  - 산사태취약지역 내 주민 대상 행동요령 홍보 및 대피 지원"", ""지원대상"": ""○ 만20세 이상인 자로서 정기소득이 없는자\r\n - (우선순위) 취업취약계층, 관할 지역주민으로 해당 지역 지리를 잘 아는자 등"", ""지원유형"": ""현금""}, ""detail"": null, ""cond"": null}","○ 만20세 이상인 자로서 정기소득이 없는자 - (우선순위) 취업취약계층, 관할 지역주민으로 해당 지역 지리를 잘 아는자 등",○ 서류전형 및 면접,만20세 이상,,"○ 임금 : 73,280원/일 ○ 주요업무 - 산사태취약지역 현장점검 및 응급조치 - 산사태취약지역 내 주민 대상 행동요령 홍보 및 대피 지원",
140000000205,임산물 소비촉진 사업 지원,"단기소득임산물 생산자에게 직거래장터, 전시회 등 제공",농림축산어업,산림청,중앙행정기관,1400000,법인/시설/단체,현금,○ 소비촉진 직거래장터 운영 ○ 우수임산물 전시회 지원 ○ 소비촉진 교육지원 등,○ 단기소득임산물 관련 산림청 등록 단체,방문신청,접수기관 별 상이,,,산림청 산림산업정책국 사유림경영소득과/042-481-1848,https://www.gov.kr/portal/rcvfvrSvc/dtlEx/140000000205,20201217142613,20250730144026,1420,,,"{""list"": {""등록일시"": ""20201217142613"", ""부서명"": ""사유림경영소득과"", ""사용자구분"": ""법인/시설/단체"", ""상세조회URL"": ""https://www.gov.kr/portal/rcvfvrSvc/dtlEx/140000000205"", ""서비스ID"": ""140000000205"", ""서비스명"": ""임산물 소비촉진 사업 지원"", ""서비스목적요약"": ""단기소득임산물 생산자에게 직거래장터, 전시회 등 제공"", ""서비스분야"": ""농림축산어업"", ""선정기준"": ""○ 선정심의회를 구성하여 신청협회기관의 규모 및 취급 품목 등 사업 추진 적합성, 사업계획의 타당성, 예산집행의 효율성 등을 평가하여 선정함"", ""소관기관명"": ""산림청"", ""소관기관유형"": ""중앙행정기관"", ""소관기관코드"": ""1400000"", ""수정일시"": ""20250730144026"", ""신청기한"": ""접수기관 별 상이"", ""신청방법"": ""방문신청"", ""전화문의"": ""산림청 산림산업정책국 사유림경영소득과/042-481-1848"", ""접수기관"": ""산림청"", ""조회수"": 1420, ""지원내용"": ""○ 소비촉진 직거래장터 운영\r\n\r\n○ 우수임산물 전시회 지원\r\n\r\n○ 소비촉진 교육지원 등"", ""지원대상"": ""○ 단기소득임산물 관련 산림청 등록 단체"", ""지원유형"": ""현금""}, ""detail"": null, ""cond"": null}",○ 단기소득임산물 관련 산림청 등록 단체,"○ 선정심의회를 구성하여 신청협회기관의 규모 및 취급 품목 등 사업 추진 적합성, 사업계획의 타당성, 예산집행의 효율성 등을 평가하여 선정함",,,,
140000000213,산림분야 사회적경제기업 지원,산림분야 사회적경제기업 성장으로 산림분야 민간일자리 창출 및 사회적가치 실현,농림축산어업,산림청,중앙행정기관,1400000,법인/시설/단체,기타,산림분야 사회적경제기업으로 전환 희망 기업 상담 등 간접 지원,o 전환이전 : 산림분야 사회적경제기업 전환 또는 사회적경제 진입을 희망하는 기업 o 전환이후 : 사회적경제기업 운영을 위한 상담 등이 필요한 기업,기타 온라인신청||방문신청,공고 시,,,산림안전보건일자리팀/042-481-1855,https://www.gov.kr/portal/rcvfvrSvc/dtlEx/140000000213,20210818193543,20250731131223,1162,,,"{""list"": {""등록일시"": ""20210818193543"", ""부서명"": ""산림안전보건일자리팀"", ""사용자구분"": ""법인/시설/단체"", ""상세조회URL"": ""https://www.gov.kr/portal/rcvfvrSvc/dtlEx/140000000213"", ""서비스ID"": ""140000000213"", ""서비스명"": ""산림분야 사회적경제기업 지원"", ""서비스목적요약"": ""산림분야 사회적경제기업 성장으로 산림분야 민간일자리 창출 및 사회적가치 실현"", ""서비스분야"": ""농림축산어업"", ""선정기준"": ""산림청 및 한국사회적기업진흥원 홈페이지에 게시되는 사업별 공고문 참조"", ""소관기관명"": ""산림청"", ""소관기관유형"": ""중앙행정기관"", ""소관기관코드"": ""1400000"", ""수정일시"": ""20250731131223"", ""신청기한"": ""공고 시"", ""신청방법"": ""기타 온라인신청||방문신청"", ""전화문의"": ""산림안전보건일자리팀/042-481-1855"", ""접수기관"": ""산림청(산림안전보건일자리팀)"", ""조회수"": 1162, ""지원내용"": ""산림분야 사회적경제기업으로 전환 희망 기업 상담 등 간접 지원"", ""지원대상"": ""o 전환이전 : 산림분야 사회적경제기업 전환 또는 사회적경제 진입을 희망하는 기업\r\n\r\no 전환이후 : 사회적경제기업 운영을 위한 상담 등이 필요한 기업"", ""지원유형"": ""기타""}, ""detail"": null, ""cond"": null}",o 전환이전 : 산림분야 사회적경제기업 전환 또는 사회적경제 진입을 희망하는 기업 o 전환이후 : 사회적경제기업 운영을 위한 상담 등이 필요한 기업,산림청 및 한국사회적기업진흥원 홈페이지에 게시되는 사업별 공고문 참조,,,,
